"puesto","empresa","nivel","area","fecha","detalle","dpto","link","fecha_scraping"
"MOZO/A - EVENTUALES","Grupo Bayton","Auxiliar","Hotelería - Gastronomía - Turismo","Hace 1 mes ","Nos encontramos en búsqueda de moza/mozo que cuente con experiencia previa, preferentemente en Hoteles.   Es requisito excluyente contar con, buena presenc ...","montevideo","/anuncio/mozo-a-eventuales-dvbae",2019-05-05 19:55:55
"CADETE C/MOTO PROPIA PARA FARMACIA DE 17 A 01 HS","Importante empresa","Auxiliar","Cadetería - Cobranzas","Hace 1 mes ","Importante empresa del rubro farmacéutico busca cadete c/moto propia.  La búsqueda se orienta a personas con gran conocimiento de calles, gusto por la aten ...","montevideo","/anuncio/cadete-c-moto-propia-para-farmacia-de-17-a-01-hs-tq8ar",2019-05-05 19:55:55
"OPERADORES TELEFÓNICOS","CertuS","Auxiliar","Teleoperadores - Call Center","Hace 1 mes ","Consultora Certus selecciona OPERADORES TELEFONICOS para ventas o cobranzas  en el turno vespertino  Te invitamos a sumarte a un equipo joven y dinámico d ...","montevideo","/anuncio/operadores-telefonicos-3egzy",2019-05-05 19:55:55
"ESTUDIANTE DE ECONOMÍA O CONTABILIDAD PARA TESTER DE SOFTWARE","GEOCOM URUGUAY","Analista","Tecnologías de la información","Hace 1 mes ","Qué proponemos? •	El desafío de participar en proyectos (nacionales e internacionales) de alto impacto •	Estabilidad y excelente ambiente laboral •	Esta ...","montevideo","/anuncio/estudiante-de-economia-o-contabilidad-para-tester-de-software-hspa6",2019-05-05 19:55:55
"ATENCION AL CLIENTE / VENTAS","Zona Phone","Auxiliar","Atención al cliente","Hace 1 mes ","Buscamos personal para Atención al Publico en nuestro local ubicado en Punta Carretas.  Tareas a realizar:  - Atención al publico y seguimiento de clientes ...","montevideo","/anuncio/atencion-al-cliente-ventas-3revm",2019-05-05 19:55:55
"MODELADOR Y DIBUJANTE TÉCNICO","BAM","Oficial","Producción","Hace 1 mes ","Modelado en Plataforma BIM , Archicad o Revit. Para el desarrollo de proyectos , respondiendo al Jefe de Proyecto. Generacion y desarrollo de la documentac ...","montevideo","/anuncio/modelador-y-dibujante-tecnico-8rr9u",2019-05-05 19:55:55
"ENCUESTADORAS/ES","Importante empresa","Auxiliar","Marketing - Publicidad","Hace 1 mes ","Para testeo de productos y relevamiento en punto de venta Para testeo de productos y relevamiento en punto de venta","montevideo","/anuncio/encuestadoras-es-t4puu",2019-05-05 19:55:55
"OFICIAL O MEDIO OFICIAL CAÑISTA","Importante empresa","Oficial","Producción","Hace 1 mes ","Se solicita Oficial o Medio Oficial Cañista de sistemas de Calefaccion y Acondicionamiento Térmico, para cubrir guardias. Encargado de operar sistemas de c ...","montevideo","/anuncio/oficial-o-medio-oficial-canista-j9y3e",2019-05-05 19:55:55
"PROGRAMADOR DE APLICACIONES","ADVICE","Analista","Tecnologías de la información","Hace 1 mes ","Importante empresa. Estudiantes avanzados de Sistemas y/o Tecnicatura de Informática. Deberán contar con los siguientes conocimientos técnicos: Javascript ...","montevideo","/anuncio/programador-de-aplicaciones-57jhp",2019-05-05 19:55:55
"ASISTENTE AUDIO VISUAL","Importante empresa","Asistente","Marketing - Publicidad","Hace 1 mes ","Importante Empresa de Uruguay se encuentra en la búsqueda de Asistente de audio Visual. Nos orientamos a personas proactivas con gran iniciativa que les gu ...","montevideo","/anuncio/asistente-audio-visual-5hrvh",2019-05-05 19:55:55
"EMPLEADA PARA RESIDENCIAL VARIOS TURNOS","Importante empresa","Auxiliar","Salud","Hace 1 mes ","Empleada para residencial 3ra edad. Imprescindible Con experiencia y carne salud vigente. para turnante y turno fijo. sueldo a mes completo 21.500 en mano. ...","montevideo","/anuncio/empleada-para-residencial-varios-turnos-mmprs",2019-05-05 19:55:55
"AUXILIAR DE LIMPIEZA","Importante empresa","Auxiliar","Servicios - Oficios","Hace 1 mes ","Lavado de Vehiculos Hombre joven . Disponibilidad horaria mañana y tarde noche.  Lunes Miercoles y Viernes de 8 a 12 . Martes Jueves y Sabado de 20 a 24 .","montevideo","/anuncio/auxiliar-de-limpieza-n5hzg",2019-05-05 19:55:55
"COCINERO","NARU SUSHI","Técnico / Especialista","Hotelería - Gastronomía - Turismo","Hace 1 mes ","Se necesita cocinero con experiencia, con conocimiento en woks, ensaladas, platos de fondo y entradas. responsable de control de stock, presentación y elab ...","montevideo","/anuncio/cocinero-7nmmu",2019-05-05 19:55:55
"COCINERO","Dolmine SA ","Técnico / Especialista","Hotelería - Gastronomía - Turismo","Hace 1 mes ","LIMPIEZA, PRODUCCIÓN, ELABORACIÓN. PUNTUALIDAD, HIGIENE, TRABAJO EN EQUIPO, ELABORACIÓN, CONTROL DE STOCK, ETC.","montevideo","/anuncio/cocinero-azn3a",2019-05-05 19:55:55
"AUXILIAR ADMINISTRATIVA","Empresa de servicios","Auxiliar","Administración - Secretariado","Hace 1 mes ","Nuestra búsqueda se orienta a personas con clara vocación de servicio y un marcado perfil de atención al cliente. Sus principales responsabilidades serán: ...","montevideo","/anuncio/auxiliar-administrativa-5yqyg",2019-05-05 19:55:55
"OFICIAL SANITARIO","Empresa de servicios","Técnico / Especialista","Construcción - Arquitectura","Hace 1 mes ","Mantenimiento preventivo en el Centro de Salud de las redes Sanitarias. Excluyente sin Titulo de UTU  "" Instalador  Sanitario"" Se valorará experiencia en h ...","montevideo","/anuncio/oficial-sanitario-pdqq8",2019-05-05 19:55:55
"AUXILIAR DE DEPOSITO EN EMPRESA DE SERVICIOS",NA,"Auxiliar","Logística - Distribución","Hace 1 mes ","Horario de 7:30 a 17.30 horas  Hombre de 25 a 40 años  De lunes a Viernes  Mantenimiento  del Stock  en el Deposito de la empresa. Apoyo al funcionamiento  ...","montevideo","/anuncio/auxiliar-de-deposito-en-empresa-de-servicios-t3hm5",2019-05-05 19:55:55
"GESTOR DE COBRANZAS",NA,"Auxiliar","Administración - Secretariado","Hace 1 mes ","Nos encontramos en la búsqueda de Gestores de Cobranzas. Cuáles serán las tareas? Los Gestores de Cobranza tendrán bajo responsabilidad la atención telefó ...","montevideo","/anuncio/gestor-de-cobranzas-pdbe3",2019-05-05 19:55:55
"AUXILIAR DE VENTAS","Importante empresa","Auxiliar","Atención al cliente","Hace 1 mes ","Orientamos nuestra búsqueda hacia jóvenes de entre 20 y 29 años que cuenten con bachillerato completo. Será excluyente contar con experiencia de al menos u ...","montevideo","/anuncio/auxiliar-de-ventas-uh79a",2019-05-05 19:55:55
"ATENCION EN SUPER","super Manu","Auxiliar","Servicios - Oficios","Hace 1 mes ","Tareas varias de supermercado Varias","montevideo","/anuncio/atencion-en-super-b3dn2",2019-05-05 19:55:55
"MANTENIMIENTO EN GENERAL","super Manu","Supervisor / Encargado","Producción","Hace 1 mes ","conocimientos basicos de electricidad, construccion ,sanitaria, manejo de herramientas, dinamico , responsable, responsable en general","montevideo","/anuncio/mantenimiento-en-general-g4eqj",2019-05-05 19:55:55
"VENDEDOR CORPORATIVO","Importante empresa","Ejecutivo Comercial","Ventas - Comercial","Hace 1 mes ","Vendedor Corporativo independiente. La búsqueda se orienta a personas de ambos sexos con experiencia en ventas de servicios a empresas. Preferiblemente co ...","montevideo","/anuncio/vendedor-corporativo-z84j8",2019-05-05 19:55:55
"COCINERA PARA ROTISERIA","Importante empresa","Auxiliar","Hotelería - Gastronomía - Turismo","Hace 1 mes ","Cocinera para rotiseria , saber elaborar comida para congelar , minutas , empanadas , tartas , etc Cocinar","montevideo","/anuncio/cocinera-para-rotiseria-4s2qn",2019-05-05 19:55:55
"COCINERO","Importante empresa","Técnico / Especialista","Hotelería - Gastronomía - Turismo","Hace 1 mes ","Cocinero Cocinero Con experiencia buena presencia agil y dinamico, presentar CV en Amazonas 1407, Esq Orinoco.","montevideo","/anuncio/cocinero-rheq7",2019-05-05 19:55:55
"CHOFER PARA SUPERGÁS","Reparto supergás","Peon","Servicios - Oficios","Hace 1 mes ","Reparto de supergás en zafra para montevideo Deberá repartir en su vehículo propio garrafas para varias zonas de Mtveo.","montevideo","/anuncio/chofer-para-supergas-q8r44",2019-05-05 19:55:55
"ASISTENTE DE VENTAS, MARKETING Y COMUNICACION","Importante empresa","Ejecutivo Comercial","Ventas - Comercial","Hace 1 mes ","Experiencia en la atención a clientes, vendedores, ventas , conocimientos de marketing Importante Importadora de artículos del hogar, busca asistente para  ...","montevideo","/anuncio/asistente-de-ventas-marketing-y-comunicacion-hjpz9",2019-05-05 19:55:55
"ASESOR Y/O VENDEDOR","ARDINIX S.A.","Ejecutivo Comercial","Ventas - Comercial","Hace 1 mes ","Posibilidad de incorporarse a una importante empresa importadora ARDINIX S.A como Asesor comercial o vendedor/a especializado  en ventas de artículos de  p ...","montevideo","/anuncio/asesor-y-o-vendedor-2yjdv",2019-05-05 19:55:55
"VENDEDOR","COLORIN LTD S.A","Ejecutivo Comercial","Ventas - Comercial","Hace 1 mes ","Venta y cobranza en Montevideo Imprecindible locomociòn propia","montevideo","/anuncio/vendedor-nr7qh",2019-05-05 19:55:55
"VENDEDOR DE SERVICIOS","Importante empresa","Ejecutivo Comercial","Ventas - Comercial","Hace 1 mes ","Buscamos un ejecutivo/a con marcada vocación para el trabajo a resultados. Mayor de 30 años. Deben contar con experiencia en venta de servicios vinculados  ...","montevideo","/anuncio/vendedor-de-servicios-4tuzg",2019-05-05 19:55:55
"TÉCNICO DE CALLE",NA,"Técnico / Especialista","Tecnologías de la información","Hace 1 mes ","Brindar soluciones a nuestros clientes en temas informáticos, tanto de manera presencial como remota (HelpDesk, Soporte Técnico, Instalaciones). Excluyent ...","montevideo","/anuncio/tecnico-de-calle-qge36",2019-05-05 19:55:55
"ROCHE: KEY ACCOUNT MANAGER (KAM) - DIVISIÓN DIAGNÓSTICA","ADVICE","Jefe","Ventas - Comercial","Hace 1 mes ","Será responsable por: - Cumplir con las cuotas de ventas, KPI de los portafolios definidos anualmente y los objetivos de rentabilidad establecidos para las ...","montevideo","/anuncio/roche-key-account-manager-kam-division-diagnostica-ssbuv",2019-05-05 19:55:55
"ASISTENTE DE COMERCIO EXTERIOR","ADVICE","Asistente","Comercio Exterior","Hace 1 mes ","Será responsable por: La gestión de documentación de exportaciones. El análisis y seguimiento de cartas de crédito. La contabilización de costos de embarqu ...","montevideo","/anuncio/asistente-de-comercio-exterior-h87n4",2019-05-05 19:55:55
"BACK OFFICE CON IDIOMAS PORTUGUÉS E INGLÉS","ADVICE","Asistente","Administración - Secretariado","Hace 1 mes ","Tendrá a su cargo el procesamiento de formularios e información. Dará respuesta a las consultas provenientes de clientes del exterior. Realizará el procesa ...","montevideo","/anuncio/back-office-con-idiomas-portugues-e-ingles-m7ggv",2019-05-05 19:55:55
"VENDEDOR","Almacen por Mayor","Ejecutivo Comercial","Ventas - Comercial","Hace 1 mes ","Venta presencial Buena presencia, continuidad en la tarea, actitud positiva ante la tarea","montevideo","/anuncio/vendedor-nm5b7",2019-05-05 19:55:55
"CHOFER","1919 y 141","Oficial","Servicios - Oficios","Hace 1 mes ","trabajo principalmente fines de semana responsabilidad y dedicacion para el auto. Con referencias!!","montevideo","/anuncio/chofer-8qntj",2019-05-05 19:55:55
"INSTRUCTOR DE MANEJO","Academia F&M ","Medio Oficial","Producción","Hace 1 mes ","Instruir y educar a los nuevos conductores Buscamos personal con o sin experiencia en el rubro de instructor de manejo. Puntos a tener en cuenta: Debe ten ...","montevideo","/anuncio/instructor-de-manejo-qnymv",2019-05-05 19:55:55
"COORDINADOR DE OBRAS","Empresa líder en su rubro","Jefe","Construcción - Arquitectura","Hace 1 mes ","Realizar relevamientos y coordinar instalaciones / obras. Interactuar con clientes, recabas la información necesaria para la presupuestación. Realizar las  ...","montevideo","/anuncio/coordinador-de-obras-7shyz",2019-05-05 19:55:55
"INGENIERO FORESTAL","Importante empresa","Profesional","Agroindustria","Hace 1 mes ","Se trata de una propuesta para desempeñarse en el área de planificación de la empresa. Reportando directamente al jefe del sector. La función se orientará ...","montevideo","/anuncio/ingeniero-forestal-3tvnq",2019-05-05 19:55:55
"AUXILIAR DE VIGILANCIA","Irvick  Group","Auxiliar","Seguridad - Vigilancia","Hace 1 mes ","Control  de accesos para edificios/empresas e instituciones Sera responsable de velar por la seguridad del predio al cual se lo asigne","montevideo","/anuncio/auxiliar-de-vigilancia-j42pu",2019-05-05 19:55:55
"CHOFER PARA UBER","Permisario Aplicaciones","Peon","Servicios - Oficios","Hace 1 mes ","Conducir horario a determinar coche nuevo. Ser extremadamente cuidadoso con las normativas de transito, limpieza y cuidado del vehículo. Buena presencia y  ...","montevideo","/anuncio/conductor-para-aplicaciones-transporte-uber-muga6",2019-05-05 19:55:55
"DISEÑADOR WEB","EMPRESA EL PAIS SA","Asistente","Tecnologías de la información","Hace 1 mes ","Conocimientos que nos interesa que tengas: - HTML5, CCS3 - Frameworks y CMS - After Effects, Premiere o similares  - Interesante portfolio o experiencia fr ...","montevideo","/anuncio/disenador-web-4eg5p",2019-05-05 19:55:55
"INGENIERO Y ANALISTA DE SISTEMAS","Servicios Informaticos","Profesional","Tecnologías de la información","Hace 1 mes ","Ingeniero y Analista de Sistemas con experiencia para tareas de Desarrollo y Analista Funcional para oportunidad laboral en Empresa Multinacional en plaza. ...","montevideo","/anuncio/ingeniero-y-analista-de-sistemas-qgpvu",2019-05-05 19:55:55
"DESARROLLADOR C# AND MICROSOFT .NET - PARA IMPORTANTE EMPRESA DE TECNOLOGÍA","MAZARS","Analista","Tecnologías de la información","Hace 1 mes ","Se trata de un cargo de Desarrollador para el cual se requiere experiencia en desarrollo y uso de herramientas de: - C# and Microsoft .NET - Visual C++ - A ...","montevideo","/anuncio/desarrollador-c-and-microsoft-net-para-importante-empresa-de-tecnologia-2ba28",2019-05-05 19:55:55
"ASISTENTE ADMINISTRATIVO DE RECURSOS HUMANOS","Importante empresa","Asistente","Recursos Humanos","Hace 1 mes ","Sumamos a nuestro equipo de trabajo, técnicos en administración y/o recursos humanos.  Asistirá al área realizando tareas  administrativas de gestión diar ...","montevideo","/anuncio/asistente-administrativo-de-recursos-humanos-3dyde",2019-05-05 19:55:55
"MOZA",NA,"Auxiliar","Hotelería - Gastronomía - Turismo","Hace 3 semanas "," MOZA para local nocturno presentarse en Convencion 1260 esquina  Soriano a partir lunes a las 15 horas.","montevideo","/anuncio/moza-us8p2",2019-05-05 19:55:55
"TECNICO ELECTONICA/ELECTROTECNIA","Borcam seguridad srl","Técnico / Especialista","Producción","Hace 3 semanas ","Buscamos técnicos o estudiantes de electrónica/electrotecnia para empresa de seguridad electronica. Buscamos personas dinámicas y responsables para integra ...","montevideo","/anuncio/tecnico-electonica-electrotecnia-n872d",2019-05-05 19:55:55
"MOZO TURNO MAÑANA",NA,"Auxiliar","Hotelería - Gastronomía - Turismo","Hace 3 semanas ","Hotel De Cadena Internacional de 3 estrellas, solicita Mozo turno mañana para desayuno / almuerzo  de 6am a 14hs. MISIÓN: Atender y servir al cliente en el ...","montevideo","/anuncio/mozo-turno-manana-z4m4a",2019-05-05 19:55:55
"TURNANTE PARA RESIDENCIA","Importante empresa","Auxiliar","Servicios - Oficios","Hace 3 semanas ","Se encargará de cubrir los libres de sus compañeros, sus funciones se encuentran tanto en el área de limpieza como de atención a los huéspedes, familiares  ...","montevideo","/anuncio/turnante-para-residencia-vazg9",2019-05-05 19:55:55
"ANALISTA DE DEMANDA","ADVICE","Analista","Logística - Distribución","Hace 3 semanas ","Será responsable por la consolidación, seguimiento de información y elaboración de reportes para la creación del Forecast del proceso de compras, que le im ...","montevideo","/anuncio/analista-de-demanda-gtqae",2019-05-05 19:55:55
"ASESOR COMERCIAL","ADVICE","Ejecutivo Comercial","Ventas - Comercial","Hace 3 semanas ","Será responsable del proceso de venta: desde la búsqueda de potenciales clientes hasta la concreción de la misma.  Brindará asesoramiento acerca del produc ...","montevideo","/anuncio/asesor-comercial-mtmnz",2019-05-05 19:55:55
"FONOAUDIOLOGA FONOAUDIOLOGIA","Importante empresa en Pocitos","Técnico / Especialista","Salud","Hace 4 semanas ","Trabajo en Clínica de rehabilitación de Niños y Adolescentes Trabajo en Equipo supervisado por Dirección Técnica.","montevideo","/anuncio/fonoaudiologa-fonoaudiologia-pmny5",2019-05-05 19:55:55
"VENDEDOR/A","Importante organización","Ejecutivo Comercial","Ventas - Comercial","Hace 4 semanas ","Contactar con Cartera de Clientes de Alta Renta (profesionales, directivos/ejecutivos) para colocación de exclusivo producto artístico para campaña financi ...","montevideo","/anuncio/vendedor-a-a57r4",2019-05-05 19:55:55
"VENDEDORA PARA LOCAL DE GALERIA JARDIN DEL CENTRO","Miami.uy","Ejecutivo Comercial","Ventas - Comercial","Hace 4 semanas ","Mostrar productos y realizar ventas en un local comercial de la Galeria Jardin a metros de la Intendencia de Montevideo. Horario Lunes a Viernes de 11 a 15 ...","montevideo","/anuncio/vendedora-para-local-de-galeria-jardin-del-centro-528n3",2019-05-05 19:55:55
"LIMPIAVIDRIOS","Chanalt","Auxiliar","Servicios - Oficios","Hace 4 semanas ","Buscamos limpiavidrios con experiencia y herramientas (excluyente) con disponibilidad horaria. Ingresara en una empresa con mas de 15 años en el mercado. S ...","montevideo","/anuncio/limpiavidrios-4mr7z",2019-05-05 19:55:55
"CADETE CON VEHÍCULO MOTO","Possum Consulting","Auxiliar","Cadetería - Cobranzas","Hace 4 semanas ","Seleccionamos para empresa líder sector distribución y logística - Cadete con vehiculo moto para trabajar dentro de la zona Metropolitana así como en Monte ...","montevideo","/anuncio/cadete-con-vehiculo-moto-9ev7q",2019-05-05 19:55:55
"ELECTRICISTA","VARINTER S.A","Técnico / Especialista","Construcción - Arquitectura","Hace 4 semanas ","Empresa del rubro mantenimiento integral selecciona personal para realizar tareas como electricista. Requerimiento excluyente: tecnicatura en electricidad  ...","montevideo","/anuncio/electricista-9ehyn",2019-05-05 19:55:55
"BOMBISTA","VARINTER S.A","Técnico / Especialista","Producción","Hace 4 semanas ","Empresa del rubro mantenimiento integral selecciona personal para realizar tareas como bombista. Requerimiento excluyente: conocimientos en reparación de b ...","montevideo","/anuncio/bombista-zgee8",2019-05-05 19:55:55
"CHOFER BOMBISTA","Importante empresa","Medio Oficial","Producción","Hace 4 semanas ","Operar bomba de hormigon Manejar camion bomba de hormigon Operar camioin bomba de hormigon Ajustar hormigon Lavar camion bomba Revisar estado de operacion  ...","montevideo","/anuncio/chofer-bombista-mvgnq",2019-05-05 19:55:55
"CHOFER DE CAMIÓN HORMIGONERA","Importante empresa","Medio Oficial","Producción","Hace 4 semanas ","Operar camion hormigonera. LIBRETA D OBLIGATORIA Manejar camion hormigonera. Operar el camion en la descarga. Ajustar el hormigon. Lavar camión. Controlar  ...","montevideo","/anuncio/chofer-de-camion-hormigonera-vjd33",2019-05-05 19:55:55
"SERIGRAFISTA","Importante empresa","Oficial","Producción","Hace 4 semanas ","estampador textil con experiencia encargado del estampado de prendas y matrizado","montevideo","/anuncio/serigrafista-v89y4",2019-05-05 19:55:55
"PERSONAL PARA MANTENIMIENTO EDILICIO DE LOCALES","Importante empresa","Supervisor / Encargado","Producción","Hace 1 mes ","Nos encontramos en la búsqueda de una persona con conocimiento en áreas relacionadas con la construcción (herrería, sanitaria, albañilería, etc) para mante ...","montevideo","/anuncio/personal-para-mantenimiento-edilicio-de-locales-3n827",2019-05-05 19:55:55
"ASISTENTE DE PRODUCCIÓN PARA INDUSTRIA BIOQUÍMICA","ADVICE","Auxiliar","Producción","Hace 1 mes ","Asistirá y ejecutará todas las actividades vinculadas a la purificación de sustancias, cumpliendo estrictamente los procedimientos e instructivos de la emp ...","montevideo","/anuncio/asistente-de-produccion-para-industria-bioquimica-yn4a4",2019-05-05 19:55:55
"DELIVERY C/MOTO PROPIA","Importante empresa","Auxiliar","Cadetería - Cobranzas","Hace 1 mes ","Importante empresa del rubro farmacéutico busca Delivery c/moto propia.  La búsqueda se orienta a personas con gran conocimiento de calles, gusto por la a ...","montevideo","/anuncio/delivery-c-moto-propia-r3nba",2019-05-05 19:55:55
"EJECUTIVO DE CUENTAS","Importante empresa","Ejecutivo Comercial","Ventas - Comercial","Hace 1 mes ","Orientamos la búsqueda a jóvenes vendedores, que cuenten con experiencia en posiciones similares y marcado perfil comercial. Fuerte foco en el cliente, ori ...","montevideo","/anuncio/ejecutivo-de-cuentas-b6pj6",2019-05-05 19:55:55
"ADMINISTRATIVA",NA,"Auxiliar","Administración - Secretariado","Hace 3 semanas "," ADMINISTRATIVA 25 a 45 años, con formacion en administracion, dominio de office, resida en Montevideo. lunes a viernes 8 horas sabados 5 horas.","montevideo","/anuncio/administrativa-qpqa7",2019-05-05 19:55:55
"RESPONSABLE DE CALIDAD","ADVICE","Jefe","Producción","Hace 3 semanas ","Llevará adelante la implementación del Sistema de Gestión Integrado. Hará relevamiento y auditoría de procesos. Realizará informes, planes de acción y prop ...","montevideo","/anuncio/responsable-de-calidad-zppu4",2019-05-05 19:55:55
"JEFE DE CONTABILIDAD Y TESORERÍA","ADVICE","Jefe","Finanzas - Contabilidad - Auditoria","Hace 3 semanas ","Será responsable de la supervisión de las áreas de Contabilidad y Tesorería. Organizará y supervisará el trabajo del área. Realizará el análisis de coheren ...","montevideo","/anuncio/jefe-de-contabilidad-y-tesoreria-r7mpv",2019-05-05 19:55:55
"ASISTENTE DENTAL",NA,"Profesional","Salud","Hace 3 semanas "," No estudiante de Odontologia, disponibilidad horaria 8 hrs.","montevideo","/anuncio/asistente-dental-g66n7",2019-05-05 19:55:55
"VENDEDORA",NA,"Ejecutivo Comercial","Ventas - Comercial","Hace 3 semanas "," VENDEDORA horario de 15 a 19 hrs buen sueldo","montevideo","/anuncio/vendedora-pv9sb",2019-05-05 19:55:55
"CADETE PARA DEPOSITO Y TRAMITES",NA,"Auxiliar","Cadetería - Cobranzas","Hace 3 semanas ","tareas de deposito, limpieza, tramites en el centro tareas de deposito, limpieza, tramites en el centro","montevideo","/anuncio/cadete-para-deposito-y-tramites-63r7b",2019-05-05 19:55:55
"CHOFER DE TAXI",NA,"Peon","Servicios - Oficios","Hace 3 semanas "," libreta cat. E de Montevideo,  con o sin experiencia en taxi","montevideo","/anuncio/chofer-de-taxi-88anp",2019-05-05 19:55:55
"ILUSTRADOR",NA,"Técnico / Especialista","Arte - Diseño - Comunicación","Hace 3 semanas "," ILUSTRADOR y/o Diseñador gráfico empresa busca.","montevideo","/anuncio/ilustrador-2h7sj",2019-05-05 19:55:55
"AUXILIAR DE LIMPIEZA","Importante empresa","Auxiliar","Servicios - Oficios","Hace 3 semanas ","Auxiliar de limpieza, turno vespertino (14:00 a 22:00), Rotativo 5-1, preferiblemente masculino entre 28 y 50 años. Limpieza en Hogar de Ancianos. Limpiar  ...","montevideo","/anuncio/auxiliar-de-limpieza-8ub8a",2019-05-05 19:55:55
"MOZO DE SALÓN Y COCINA","Cafetería en carrasco","Auxiliar","Hotelería - Gastronomía - Turismo","Hace 3 semanas ","Venta de postres, atención a mesas y elaboración de productos para almuerzos. Somos una empresa que busca una chica para formar parte de nuestro equipo. Es ...","montevideo","/anuncio/mozo-de-salon-y-cocina-ah8un",2019-05-05 19:55:55
"PELUQUERA",NA,"Técnico / Especialista","Servicios - Oficios","Hace 3 semanas "," Con experiencia. Zona Parque Rodo. Buen sueldo.","montevideo","/anuncio/peluquera-g38e3",2019-05-05 19:55:55
"DISTRIBUIDOR",NA,"Auxiliar","Logística - Distribución","Hace 3 semanas "," Mailings para zafra  20 días, 6 hs diarias. Sueldo nomin al $ 11.823.","montevideo","/anuncio/distribuidor-hu4av",2019-05-05 19:55:55
"ESCRIBANA/O PÚBICO","Estudio García & Mendive","Profesional","Legal","Hace 3 semanas ","Realizar todo tipo de tareas notariales. Responsable, dinámico y puntual.","montevideo","/anuncio/escribana-o-pubico-bh6en",2019-05-05 19:55:55
"GESTOR","Estudio García & Mendive","Asistente","Cadetería - Cobranzas","Hace 3 semanas ","Estudiante de primero o segundo se escribanía para estudio notarial Realizar los tramites en tiempo y forma.","montevideo","/anuncio/gestor-9pm44",2019-05-05 19:55:55
"MAQUINISTA","oriana","Oficial","Producción","Hace 3 semanas ","OVERLOCK Y RECTA OVERLOCK Y RECTA","montevideo","/anuncio/maquinista-d24mu",2019-05-05 19:55:55
"AUXILIAR PARA DEPOSITO",NA,"Auxiliar","Logística - Distribución","Hace 3 semanas ","Auxiliar para deposito, ambos sexos,hasta de 25 años, Armar pedidos, ordenar, limpiar Los interesados deberán postularse.","montevideo","/anuncio/auxiliar-para-deposito-e7r39",2019-05-05 19:55:55
"YESERO",NA,"Oficial","Construcción - Arquitectura","Hace 3 semanas ","  Con probada experiencia, busca Empresa Constructora para obras en construcción en Montevideo. Llamar lunes después 9hs.","montevideo","/anuncio/yesero-m5vyb",2019-05-05 19:55:55
"COSEDORAS",NA,"Oficial","Producción","Hace 3 semanas "," Taller - sepan armar camperas completas con guata, en su casa, viva en Montevideo.","montevideo","/anuncio/cosedoras-5e6mu",2019-05-05 19:55:55
"OPERARIO MULTITAREA",NA,"Peon","Producción","Hace 3 semanas "," BARRA DE CARRASCO Personas de sexo masculino de 20 a 40 años.  Ciclo básico. Valorado Libreta H. L a V de 8 a 17hs. S de 8 a12hs. Preferente vivir en l ...","montevideo","/anuncio/operario-multitarea-2ep72",2019-05-05 19:55:55
"OFICIALES.",NA,"Oficial","Construcción - Arquitectura","Hace 3 semanas "," oficiales","montevideo","/anuncio/oficiales-nh5ea",2019-05-05 19:55:55
