"puesto","empresa","nivel","area","fecha","detalle","dpto","link","fecha_scraping"
"MAESTRO PANADERO","Panaderia Solis (Solis de mataojo)","Técnico / Especialista","Servicios - Oficios","Hace 1 mes ","Maestro panadero Amasado Dirigir Personal Controlar Supervisar ordenar mando","lavalleja","/anuncio/maestro-panadero-8d4e9",2019-06-17 17:38:12
"VENDEDORA DE MOSTRADOR PARA PERFUMERÍA EN CIUDAD DE FLORIDA ","Importante empresa de cosmética selecciona","Ejecutivo Comercial","Ventas - Comercial","Hace 3 semanas ","Vendedora de Mostrador entre 25 y 55 años  Atención al público - Excelente ambiente laboral ","florida","/anuncio/vendedora-de-mostrador-para-perfumeria-getn5",2019-06-17 17:38:12
"ENCARGADA/O DE TIENDA EN RIVERA","CHIC PARISIEN ","Supervisor / Encargado","Ventas - Comercial","Hace 1 semana ","Seleccionamos Encargada/o de local comercial en el Departamento de Rivera. Orientamos nuestra búsqueda a personas dinámicas con gusto por la venta y la mod ...","rivera","/anuncio/encargada-o-de-tienda-en-rivera-2s78d",2019-06-17 17:38:12
"ENCARGADA/O DE TIENDA EN CHUY","CHIC PARISIEN ","Supervisor / Encargado","Ventas - Comercial","Hace 1 semana ","Seleccionamos Encargada/o de local comercial en el Chuy. Orientamos nuestra búsqueda a personas dinámicas con gusto por la venta y la moda, con excelente h ...","rocha","/anuncio/encargada-o-de-tienda-en-chuy-h5a67",2019-06-17 17:38:12
"VENDEDOR PARA CURSO DE COACHING","Enfoque Eneagrama","Ejecutivo Comercial","Ventas - Comercial","Hace 1 semana ","¿Te interesa el coaching y la inteligencia emocional?  ¿Disfrutas hablar en pu´blico?  ¿Tienes un deseo genuino de ayudar a las empresas y su gente a tener ...","tacuarembo","/anuncio/vendedor-para-curso-de-coaching-g8vz3",2019-06-17 17:38:12
"JEFE DE ÁREA SUBESTACIONES","KPMG","Jefe","Logística - Distribución","Hace 2 semanas ","Título de Ingeniero Eléctrico, Ingeniero Electromecánico o Ingeniero Industrial  Posgrado en ingeniería eléctrica para los postulantes con título de Ingeni ...","salto","/anuncio/jefe-de-area-subestaciones-rvttq",2019-06-17 17:38:12
"SOUS CHEF",NA,"Jefe","Hotelería - Gastronomía - Turismo","Hace 5 días ","•	Experiencia de 2 años en cocinas de hotel  •	Haber ocupado un puesto de responsabilidad con personal a cargo en cocina •	Buen manejo de recursos humanos  ...","paysandu","/anuncio/sous-chef-9b2yq",2019-06-17 17:38:12
"TÉCNICO INSTALADOR PAYSANDÚ","Consultora Human Phi","Técnico / Especialista","Producción","Hace 3 días ","Seleccionamos para empresa en Paysandú Técnicos que cumplan con el siguiente perfil: Los Requisitos •	Residencia actual en la ciudad de Paysandú (excluye ...","paysandu","/anuncio/tecnico-instalador-paysandu-vnzju",2019-06-17 17:38:12
"VENDEDOR DE REPUESTOS DE MAQUINARIA AGRÍCOLA /VIAL.","  ","Ejecutivo Comercial","Ventas - Comercial","Hace 2 semanas ","•	Formación Comercial, ventas.	 •	Manejo fluido de Office. 		 •	Experiencia en venta de repuestos para maquinaria agrícola y/o vial. •	Residencia en Durazn ...","durazno","/anuncio/vendedor-de-repuestos-de-maquinaria-agricola-vial-82zuv",2019-06-17 17:38:12
"VENDEDOR/A DEPARTAMENTO DURAZNO","FORTER S.A","Ejecutivo Comercial","Ventas - Comercial","Hace 1 mes ","NO POSTULARSE SI NO VIVE EN DURAZNO! Nos encontramos en la búsqueda de vendedores y cajeros con experiencia en el rubro indumentaria para nuestro local ub ...","durazno","/anuncio/vendedor-a-g6pst",2019-06-17 17:38:12
"TÉCNICO INSTALADOR CARDONA","Consultora Human Phi","Técnico / Especialista","Producción","Hace 3 días ","Seleccionamos Técnico instalador para empresa en Cardona que cumpla con el siguiente perfil: Los Requisitos •	Residencia actual en la ciudad de Cardona ( ...","soriano","/anuncio/tecnico-instalador-cardona-gtu38",2019-06-17 17:38:12
"DISTRIBUIDOR/A PARA EL INTERIOR DEL PAÍS","Empresa","Auxiliar","Logística - Distribución","Hace 3 semanas ","Venta de esmaltes y tratamientos para uñas en peluquerias, farmacias, pañaleras, etc. Con cartera de clientes y experiencia. Venta y distribución","soriano","/anuncio/distribuidor-a-para-el-interior-del-pais-76ett",2019-06-17 17:38:12
"MERETRICES","Daiana verde ","Auxiliar","Atención al cliente","Hace 1 semana ","Se necesitan chicas de 18 a 35 años , para whiskeria en la ciudad de colonia ( nueva Palmira) alojamiento incluido , excelente ambiente laboral , zona port ...","colonia","/anuncio/meretrices-3qu9n",2019-06-17 17:38:12
"ESPECIALISTA EN COMPENSACIONES Y NÓMINA","Montes del Plata","Supervisor / Encargado","Ventas - Comercial","Hace 1 mes ","La posición supervisará la gestión de una nómina relevante y diversa, en coordinación con el partner externo que brinda soporte en esta área. Asegurará la  ...","colonia","/anuncio/especialista-en-compensaciones-y-nomina-g4v4q",2019-06-17 17:38:12
"JEFE DE OPERACIONES","AUREN","Jefe","Logística - Distribución","Hace 1 mes ","Auren Capital Humano selecciona Jefe de Operaciones para importante empresa de transporte de carga en el departamento de Colonia. Orientamos nuestra búsqu ...","colonia","/anuncio/jefe-de-operaciones-qrgbp",2019-06-17 17:38:12
"PRODUCTION PLANNER SCHEDULER - SUPPLY CHAIN","MAZARS","Jefe","Logística - Distribución","Hace 2 semanas ","Manage and coordinate material flow for purchased and sub-contracted finished goods. Partner with key personnel from demand planning, plant planning, and p ...","san-jose","/anuncio/production-planner-scheduler-supply-chain-v6tdb",2019-06-17 17:38:12
"VENDEDOR PARA CURSO COACHING","Enfoque Eneagrama","Ejecutivo Comercial","Ventas - Comercial","Hace 1 semana ","¿Te interesa el coaching y la inteligencia emocional? ¿Disfrutas hablar en pu´blico?  ¿Tienes un deseo genuino de ayudar a las empresas y su gente a tener  ...","san-jose","/anuncio/vendedor-para-curso-coaching-aqedr",2019-06-17 17:38:12
"DELIVERY","Charly Food","Auxiliar","Cadetería - Cobranzas","Hace 1 mes ","Empresa nueva en rubro comidas selecciona personal para Delivery. Se apunta a personas interesadas en pertenecer a una empresa con muy buenas condiciones d ...","san-jose","/anuncio/delivery-uavgb",2019-06-17 17:38:12
"ENCARGADO DE VENTAS","Importante empresa","Ejecutivo Comercial","Ventas - Comercial","Hace 1 mes ","CAPTAR NUEVOS CLIENTES Y POTENCIAR LOS ACTUALES AMPLIAR CARTERA DE CLIENTES MONTEVIDEO E INTERIOR","san-jose","/anuncio/encargado-de-ventas-daatr",2019-06-17 17:38:12
"CONTADOR JUNIOR","Coopace","Profesional","Finanzas - Contabilidad - Auditoria","Hace 3 semanas ","Contador Junior Capacidad de relacionamiento y de trabajo en equipo. Aptitud para desarrollar tareas bajo la exigencia de cumplimiento de objetivos. Domini ...","rio-negro","/anuncio/contador-junior-qnavn",2019-06-17 17:38:12
"JEFE DEL ÁREA DE RIESGO DE LA INSTITUCIÓN ","Coopace","Auxiliar","Administración - Secretariado","Hace 4 semanas ","Funciones: •	Evaluar riesgo de diferentes segmentos •	Analizar indicadores de gestión •	Definir causas de impacto en los diferentes estados de riesgo •	Pro ...","rio-negro","/anuncio/jefe-del-area-de-riesgo-de-la-institucion-tb5y5",2019-06-17 17:38:12
"MECÁNICO AGRÍCOLA Y/O VIAL PARA EMPRESA LÍDER DEL SECTOR AGRÍCOLA.","  ","Técnico / Especialista","Producción","Hace 1 mes ","Requisitos:  •Formación técnica en Mecánica-Electricidad automotriz, electro hidráulico. (Don Bosco, FPS, CETP-UTU). (no excluyente).  •Experiencia en oper ...","rio-negro","/anuncio/mecanico-agricola-y-o-vial-para-empresa-lider-del-sector-agricola-apb2g",2019-06-17 17:38:12
"VENDEDOR","EL oferton","Ejecutivo Comercial","Ventas - Comercial","Hace 1 mes ","SE BUSCA PAREJA DE EXTRANJEROS CON RESIDENCIA, PREFERENTEMENTE SIN HIJOS, BUENA PRESENCIA, INDISPENSABLE TENER BUEN TRATO CON LOS CLIENTES, SE FACILITA VIV ...","rio-negro","/anuncio/vendedor-b39d6",2019-06-17 17:38:12
"VENDEDOR VIAJERO PARA EL INTERIOR","Importante empresa","Ejecutivo Comercial","Ventas - Comercial","Hace 1 semana ","Vendedor para el Interior, area del Litoral del Pais, de productos alimenticios con auto propio (EXCLUYENTE), con experiencia y formacion en el área. Tendr ...","interior","/anuncio/vendedor-viajero-para-el-interior-ms9hj",2019-06-17 17:38:12
"AYUDANTES DE OBRA - PREPARACIÓN UTU IEC","Deloitte","Auxiliar","Construcción - Arquitectura","Hace 4 semanas ","El objetivo del Ayudante de UTU-IEC es dar asistencia técnica al Director de Obra en el control y ejecución de las obras de construcción vial de referencia ...","interior","/anuncio/ayudantes-de-obra-preparacion-utu-iec-2p46y",2019-06-17 17:38:12
"AYUDANTES IDÓNEOS DE OBRA","Deloitte","Medio Oficial","Construcción - Arquitectura","Hace 4 semanas ","El objetivo principal del Ayudante de Obra es dar asistencia técnica en el control y ejecución de las obras de construcción vial de referencia. Buscamos pe ...","interior","/anuncio/ayudantes-idoneos-de-obra-ypge4",2019-06-17 17:38:12
"OBSERVADORES EN CIRCUITOS","Cifra ","Auxiliar","Marketing - Publicidad","Hace 2 semanas ","CIFRA busca personas para trabajar en circuitos electorales en todo el país el día de las elecciones internas, domingo 30 de junio, de 19:00 a 23:00 horas. ...","interior","/anuncio/observadores-en-circuitos-ep23h",2019-06-17 17:38:12
"COORDINADOR GENERAL","CALAI","Supervisor / Encargado","Ventas - Comercial","Hace 1 mes ","-Planificar, dirigir y coordinar la gestión de servicios prestados por la empresa a sus productores. -Coordinación continua con los responsables de cada ár ...","interior","/anuncio/coordinador-general-9mjjb",2019-06-17 17:38:12
"LIDERES DE EQUIPOS Y VENTAS","Importante empresa","Ejecutivo Comercial","Ventas - Comercial","Hace 1 semana ","Preferentemente mayores de 50 años. Profesionalizarse, adquiriendo aptitudes de venta y liderazgo de  equipos. Tarea independiente, sin sueldo fijo. Desarr ...","maldonado","/anuncio/lideres-de-equipos-y-ventas-stq9h",2019-06-17 17:38:12
"VENDEDOR CURSO DE COACHING","Enfoque Eneagrama","Ejecutivo Comercial","Ventas - Comercial","Hace 1 semana ","¿Te interesa el coaching y la inteligencia emocional? ¿Disfrutas hablar en pu´blico?  ¿Tienes un deseo genuino de ayudar a las empresas y su gente a tener  ...","maldonado","/anuncio/vendedor-curso-de-coaching-ayuvh",2019-06-17 17:38:12
"VENDEDOR","Angelina Accesorios","Auxiliar","Atención al cliente","Hace 1 semana ","-Atención al Publico Directo -Limpieza del salón -Reposición de Productos -Asesoramiento al cliente -Arqueo de Caja -Ventas personalizadas fuera del salón  ...","maldonado","/anuncio/vendedor-u5er3",2019-06-17 17:38:12
"VENDEDOR/A IMPORTANTE MARCA – PUNTA DEL ESTE","Consultora Human Phi","Ejecutivo Comercial","Ventas - Comercial","Hace 2 semanas ","Selecciona para local comercial de prestigiosa marca ubicado en Punta del Este: Nos encontramos en la búsqueda de una persona que sea capaz de iniciar y d ...","maldonado","/anuncio/vendedor-a-importante-marca-punta-del-este-5drt8",2019-06-17 17:38:12
"RESPONSABLE DE OPERACIONES Y MANTENIMIENTO","ADVICE","Supervisor / Encargado","Producción","Hace 3 semanas ","Será responsable de las operaciones y mantenimiento para el Parque Eólico, principalmente de instalaciones eléctricas.  Realizará el seguimiento de la oper ...","maldonado","/anuncio/responsable-de-operaciones-y-mantenimiento-t384t",2019-06-17 17:38:12
"ASESOR DE RRHH","SANATORIO MAUTONE","Técnico / Especialista","Consultoría","Hace 1 mes ","Cargo part-time (aprox. 12 horas semanales), dependiente de Gerencia General Requisitos: •	Escolaridad: nivel terciario. •	Probada experiencia en gestión  ...","maldonado","/anuncio/asesor-de-rrhh-62eqs",2019-06-17 17:38:12
"ODONTOLOGO GRAL CON ESTUDIOS EN ORTODONCIA","Consultorio Odontologico","Profesional","Salud","Hace 1 mes ","Odontología gral - Armado, control y seguimiento de ortodoncia Odontología gral - diagnostico, tratamiento y seguimiento del paciente Ortodoncia - diagnost ...","maldonado","/anuncio/odontologo-gral-con-estudios-en-ortodoncia-b4hd9",2019-06-17 17:38:12
"ADMINISTRATIVO","METALFRIG","Asistente","Finanzas - Contabilidad - Auditoria","Hace 3 semanas ","MANEJO DE PROGRAMAS CONTABLES MANEJO DE PROGRAMAS","canelones","/anuncio/administrativo-398rs",2019-06-17 17:38:12
"AUXILIAR DE VENTA DE REPUESTOS - MAQUINARIA AGRÍCOLA","White Consultant","Auxiliar","Ventas - Comercial","Hace 3 semanas ","Persona con conocimiento y experiencia en Venta de Repuestos, preferentemente de Maquinaria Agrícola que resida en el departamento de Canelones (no excluye ...","canelones","/anuncio/auxiliar-de-venta-de-repuestos-maquinaria-agricola-ejsh3",2019-06-17 17:38:12
"FIAMBRERO, REPONEDOR, CAJERO","CONVIXION","Peon","Producción","Hace 4 semanas ","Para servicio eventual, esta vez con foco en personal de supermercados: Reponedor, cajero, fiambrero Estamos buscando personas con experiencia en el sector ...","canelones","/anuncio/fiambrero-reponedor-cajero-ugbnh",2019-06-17 17:38:12
"PEON PRACTICO HERRERO",NA,"Peon","Producción","Hace 1 mes ","Peón practico en herrería para funciones básicas, dispuesto a aprender Puntualidad, buena disposición y actitud laboral. vivir en ciudad de la costa (exclu ...","canelones","/anuncio/peon-practico-herrero-nvtag",2019-06-17 17:38:12
"OPERARIO DE SEGURIDAD Y MANTENIMIENTO.","Importante empresa","Auxiliar","Seguridad - Vigilancia","Hace 1 mes ","- Custodiar el perímetro externo del Centro de distribución. - Asegurar que todas las puertas y portones de acceso perimetral estén siempre cerrados y con  ...","canelones","/anuncio/operario-de-seguridad-y-mantenimiento-jabtm",2019-06-17 17:38:12
"OFICIAL CARPINTERO","Carpinteria Ciudad de la costa / Madera DURA","Oficial","Producción","Hace 1 mes ","Colaborar activamente en sacar la producción de la empresa. Se deja claro que es madera DURA , pesada, de excelentes terminaciones y calidad los productos. ...","canelones","/anuncio/oficial-carpintero-bnndb",2019-06-17 17:38:12
"SUSHIMAN HOMBRE/MUJER","Origami","Técnico / Especialista","Hotelería - Gastronomía - Turismo","Hace 1 mes ","Cocina, sushi, woks, ensaladas. Control de stock, cocina. Cocina Preparación y servicio","canelones","/anuncio/sushiman-hombre-mujer-dy3re",2019-06-17 17:38:12
"MOZ@ Y ASISTENTE DE COCINA","Empresa en crecimiento","Auxiliar","Hotelería - Gastronomía - Turismo","Hace 1 mes ","Atender clientes Servir mesas Limpieza del local Ayuda en la elaboración de productos en la cocina Asistir en controles de stock Deberá tener actitud proac ...","canelones","/anuncio/moz-y-asistente-de-cocina-dzp49",2019-06-17 17:38:12
"ENCARGADO/A DE CAJAS","Importante empresa","Supervisor / Encargado","Ventas - Comercial","Hace 1 mes ","Seleccionamos para local comercial en Costa Urbana: Encargada/o de Cajas Deberá residir en zonas próximas  o estar dispuesto/a al traslado hasta el lugar.  ...","canelones","/anuncio/encargado-a-de-cajas-46jyz",2019-06-17 17:38:12
"VENDEDORA","Salud bienestar y calidad de vida ","Ejecutivo Comercial","Ventas - Comercial","Hace 1 mes ","Se necesitan Vendedoras de 18 a 33 años con o sin experiencia. Horario Part-Time o Full-Time. Responsable Comprometido  Buena Presencia  Dinámico","canelones","/anuncio/vendedora-tdv3u",2019-06-17 17:38:12
"VIGILANTE DE SALÓN EN ZONA PINAMAR CON EXPERIENCIA COMPROBABLE","SUPERMERCADO IMPERIO DEL ESTE","Auxiliar","Seguridad - Vigilancia","Hace 1 mes ","VIGILANCIA DEL SALÓN CONTROL DE FUNCIONARIOS VIGILANTE DE SALÓN para supermercado viva próximo a la zona de Pinamar","canelones","/anuncio/vigilante-o-guardia-en-zona-pinamar-con-experiencia-comprobable-vuqdr",2019-06-17 17:38:12
"VENDEDORA","Salud bienestar y calidad de vida ","Auxiliar","Atención al cliente","Hace 1 mes ","Se necesitan Vendedoras de 18 a 33 años con o sin experiencia. Horario Part-Time o Full-Time. Responsable Comprometido  Buena Presencia  Dinámico","canelones","/anuncio/vendedora-y5tq7",2019-06-17 17:38:12
"CASERO PARA CHACRA CERCA DE MONTEVIDEO","Importante empresa","Auxiliar","Seguridad - Vigilancia","Hace 1 mes ","Se busca matrimonio para ir a vivir a una chacra cerca de Montevideo donde contamos con gallinas, chanchos, caballos, vacas y ovejas. Además contamos con u ...","canelones","/anuncio/casero-para-chacra-cerca-de-montevideo-qqbdj",2019-06-17 17:38:12
"AUXILIAR MECÁNICO AUTOMOTRIZ - LAGOMAR","Importante empresa","Técnico / Especialista","Producción","Hace 1 mes ","Nos orientamos a la búsqueda de personas responsables, proactivas y con marcado perfil orientado al cliente, para estación de servicio ubicada en Lagomar.  ...","canelones","/anuncio/mecanico-lagomar-juatg",2019-06-17 17:38:12
"PANDO APRENDIZ DE VENTAS - CAJA","Importante empresa de Retail","Auxiliar","Ventas - Comercial","Hace 1 mes ","Buscamos personas con gusto por la atención al cliente y ventas, para formar parte del equipo de nuestra nueva tienda en PANDO. Si tenés más de 18 años, s ...","canelones","/anuncio/pando-aprendiz-de-ventas-aprendiz-de-cajas-yemum",2019-06-17 17:38:12
"COCINERO","Empanadas Don Pedro","Técnico / Especialista","Hotelería - Gastronomía - Turismo","Hace 1 mes ","Cocina tradicional. Empanadas pastas minutas etc. responsable en su trabajo, puntualidad, viva en la zona de Ciudad de la costa. trabajo fijo en el horario ...","canelones","/anuncio/cocinero-2774u",2019-06-17 17:38:12
"EXPERTO EN REDES SOCIALES","Importante empresa","Supervisor / Encargado","Tecnologías de la información","Hace 1 mes ","Manejo de redes sociales, atención al público, ventas, tareas administrativas Manejo perfecto de redes sociales","canelones","/anuncio/experto-en-redes-sociales-pdy6h",2019-06-17 17:38:12
"MAESTRO PANADERO","EMPRESA ZONA PINAMAR","Técnico / Especialista","Hotelería - Gastronomía - Turismo","Hace 1 mes ","ELABORACIÓN (PANES, BIZCOCHOS, PIZZAS, OJITOS, POLVORONES,) HIGIENE DEL LUGAR Y MAQUINARIA.","canelones","/anuncio/maestro-panadero-aydqq",2019-06-17 17:38:12
"ADMINISTRATIVO CONTABLE","Consultora","Asistente","Finanzas - Contabilidad - Auditoria","Hace 3 días ","CONTABLES, REGISTRACIONES CONCILIACIONES DE ACUERDO AL CARGO","canelones","/anuncio/administrativo-contable-sa2sn",2019-06-17 17:38:12
"REPONEDORES PARA LOCAL UBICADO EN SHOPPING COSTA URBANA","AGLH Consultores","Auxiliar","Ventas - Comercial","Hace 6 días ","La persona deberá realizar tareas tales como reposición de mercadería, control de stock, orden y mantenimiento del lugar de trabajo Orientamos la búsqueda  ...","canelones","/anuncio/reponedores-para-local-ubicado-en-shopping-costa-urbana-t47ma",2019-06-17 17:38:12
"COMUNICADOR - PERIODISTA","Importante empresa","Profesional","Arte - Diseño - Comunicación","Hace 1 semana ","item 1.- comunicador para radio y tv. con experiencia en ventas item 2.- vendedor  con experiencia en intangibles  item 3.- marketing comunicación radio y/ ...","canelones","/anuncio/comunicador-periodista-9he92",2019-06-17 17:38:12
"SOLDADOR EN ALTURA","EMPRESA METALURGICA","Técnico / Especialista","Producción","Hace 1 semana ","Soldador para trabajo zafral de 3 meses de montaje de galpón. Preferentemente en zona de Las Piedras o Progreso. Deberá trabajar  en equipo de armado de un ...","canelones","/anuncio/soldador-en-altura-mvj4z",2019-06-17 17:38:12
"CHOFER DE CAMIÓN","Empresa de transporte","Peon","Servicios - Oficios","Hace 2 semanas ","Chofer repartidor para distribución en Montevideo Chofer categoría B con experiencia en repartos en Montevideo. Excluyente domicilio en la Costa de Oro.","canelones","/anuncio/chofer-de-camion-yvnub",2019-06-17 17:38:12
"VENDEDORA","Importante Empresa","Ejecutivo Comercial","Ventas - Comercial","Hace 2 semanas ","- Para Joyería  Entre 25 y 45 años En Costa Urbana Shopping, Ciudad de la Costa Buena presencia Al postularse adjuntar foto ","canelones","/anuncio/vendedora-s5psb",2019-06-17 17:38:12
"ELECTRICISTA AUTOMOTRIZ","Empresa de mecánica pesada","Técnico / Especialista","Producción","Hace 2 semanas ","Electricidad de vehículos pesados. Mantenimiento de vehiculos","canelones","/anuncio/electricista-automotriz-qsm3d",2019-06-17 17:38:12
"TECNICO INSTALADOR JUNIOR","Importante Empresa","Oficial","Servicios - Oficios","Hace 2 semanas ","Instalación de equipos con sólida base en electricidad e informática. Buena presencia Horario full time Libreta de chofer vigente Instalación y mantenimien ...","canelones","/anuncio/tecnico-instalador-junior-j8daj",2019-06-17 17:38:12
"REPONEDOR EXTERNO (MONTEVIDEO-PANDO)","Importante empresa","Auxiliar","Ventas - Comercial","Hace 3 semanas ","El cargo es part time en horas de la tarde. La ruta implica trabajar algunos días en Montevideo y otros en Pando. La tarea es arreglar las exhibiciones de  ...","canelones","/anuncio/reponedor-externo-montevideo-pando-p9z46",2019-06-17 17:38:12
"PEÓN","TEREFEL SA","Peon","Producción","Hace 3 semanas ","PEONES Y OFICIALES PARA LÍNEA DE PRODUCCIÓN EN FRIGORÍFICO. ASIDUIDAD, RESPONSABILIDAD EN LAS TAREAS QUE EL REFERENTE O ENCARGADO ASIGNE.","canelones","/anuncio/peon-daqgr",2019-06-17 17:38:12
"CAJA","Ferreteria y Barraca VQ","Auxiliar","Ventas - Comercial","Hace 3 semanas ","Atención de caja  Tareas administrativas  Manejo de excel Manejo de programa zlibra Debe atender caja y manejar planilla excel así como realizar tareas de  ...","canelones","/anuncio/caja-rutds",2019-06-17 17:38:12
"CHOFER REPARTIDOR","Tres Puntos","Auxiliar","Logística - Distribución","Hace 3 días ","Armado de pedidos Visitar y crear clientes Compras y control de stock Cobranzas Preferentemente de la zona  Desarrollar y mantener cartera de clientes con  ...","canelones","/anuncio/chofer-repartidor-bpt6e",2019-06-17 17:38:12
"VENDEDORA","Salud bienestar y calidad de vida ","Ejecutivo Comercial","Ventas - Comercial","Hace 6 días ","Se necesitan vendedoras de 18 a 33 años con o sin experiencia en ventas. Horario Part-Time o Full-Time. Buena Presencia Responsabilidad Buena actitud  Diná ...","canelones","/anuncio/vendedora-6s2am",2019-06-17 17:38:12
"OFICIAL HERRERO","Importante empresa","Oficial","Producción","Hace 1 semana ","Armado rejas, escaleras, plataformas. etc. En su cargo, cumplimiento de horarios .","canelones","/anuncio/oficial-herrero-nst25",2019-06-17 17:38:12
"OFICIAL ELECTRO CONTROL","PwC Uruguay","Oficial","Producción","Hace 1 semana ","Este llamado es abierto y contempla lo establecido por la Ley 18.651 referida a personas con discapacidad y deberán expresarlo en su postulación. Requisit ...","canelones","/anuncio/oficial-electro-control-apmhr",2019-06-17 17:38:12
"INSTALADOR DE ALARMAS RESIDENCIALES, COMERCIALES Y CCTV","Importante empresa","Oficial","Servicios - Oficios","Hace 2 semanas ","Instalación y Mantenimiento de Sistemas de Alarmas y Cámaras de Seguridad. Nuestra empresa le brinda el servicio de instalación a reconocidas empresas en e ...","canelones","/anuncio/instalador-de-alarmas-residenciales-comerciales-y-cctv-4zth3",2019-06-17 17:38:12
"PISTERO / LAVADOR","Importante empresa","Auxiliar","Atención al cliente","Hace 2 semanas ","Nos orientamos a la búsqueda de personas responsables, pro-activas y con marcado perfil orientado al cliente, para estación de servicio ubicada en CIUDAD D ...","canelones","/anuncio/pistero-lavador-z3tzb",2019-06-17 17:38:12
"FIAMBRERA  PARA SUPER EN ZONA PINAMAR",NA,"Auxiliar","Hotelería - Gastronomía - Turismo","Hace 2 semanas ","FIAMBRERA HORARIOS, CONTROL DE STOCK, VENCIMIENTOS, ETC.","canelones","/anuncio/encargada-de-fiambreria-3hd3s",2019-06-17 17:38:12
"VETERINARIO O ESTUDIANTE AVANZADO","SIBLENCO S.A","Profesional","Agroindustria","Hace 2 semanas ","Veterinario o estudiante para clinica de pequeños en ciudad de la costa con dos sucursales .Part time 8hs dos dias semanales. Veterinario o estudiante para ...","canelones","/anuncio/veterinario-o-estudiante-avanzado-p3qbr",2019-06-17 17:38:12
"AUXILIAR DE OPERACIONES LOGÍSITCAS","Importante empresa","Asistente","Comercio Exterior","Hace 3 semanas ","Seguimiento de cargas -Ingreso de datos al sistema informático. Atención de proveedores.							 Confección de documentación operativa.							 Tramitación d ...","canelones","/anuncio/auxiliar-de-operaciones-logisitcas-qm65d",2019-06-17 17:38:12
"VENDEDORA","Salud bienestar y calidad de vida ","Ejecutivo Comercial","Ventas - Comercial","Hace 3 semanas ","Se necesitan Vendedoras de 18 a 33 años con o sin experiencia. Horario Part-Time o Full-Time. Responsable Comprometido  Buena Presencia  Dinámico","canelones","/anuncio/vendedora-eeszu",2019-06-17 17:38:12
"CARNICERO CORTADOR CON EXPERIENCIA, ZONA PINAMAR, CANELONES",NA,"Auxiliar","Servicios - Oficios","Hace 3 semanas ","CORTAR DESARMAR LIMPIEZA ATENCIÓN AL PÚBLICO SELECCIONAMOS CARNICERO CORTADOR CON EXPERIENCIA Y REFERENCIAS COMPROBABLES","canelones","/anuncio/carnicero-cortador-con-experiencia-zona-pinamar-canelones-d5hgn",2019-06-17 17:38:12
"SUPERVISOR DE DISTRIBUCIÓN","PwC Uruguay","Supervisor / Encargado","Producción","Hace 3 semanas ","Este llamado es abierto y contempla lo establecido por la Ley 18.651 referida a personas con discapacidad y deberán expresarlo en su postulación al enviar  ...","canelones","/anuncio/supervisor-de-distribucion-e6be8",2019-06-17 17:38:12
"ATENCIÓN AL CLIENTE","Importante empresa de Retail","Ejecutivo Comercial","Ventas - Comercial","Hace 3 semanas ","Buscamos personas con gusto por la atención al cliente y ventas, para trabajar en tiendas ubicadas en la zona de Portones Shopping, Costa Urbana Shopping y ...","canelones","/anuncio/atencion-al-cliente-vgdje",2019-06-17 17:38:12
"SUPERVISOR DE COMPRAS","PwC Uruguay","Supervisor / Encargado","Producción","Hace 3 semanas ","Este llamado es abierto y contempla lo establecido por la Ley 18.651 referida a personas con discapacidad y deberán expresarlo en su postulación al enviar  ...","canelones","/anuncio/supervisor-de-compras-jdvea",2019-06-17 17:38:12
