"puesto","empresa","nivel","area","fecha","detalle","link","departamento","fecha_scraping"
"CAJERA ADMINISTRATIVA PARA SHOPPING","","Auxiliar","Ventas - Comercial","Hace 3 semanas ","Nos encontramos en la búsqueda de cajeras administrativas para tiendas de indumentaria y calzado en shopping.

Es requisito ser mayor de 25 años y tener ex ...","https://trabajo.gallito.com.uy/anuncio/cajera-administrativa-para-shopping-t46m6","montevideo",2019-10-17 16:10:35
"ASISTENTE DE RRHH","","Asistente","Recursos Humanos","Hace 3 semanas ","Realizar procesos de reclutamiento y selección de personal, relevamiento de perfiles de cargos solicitados y redacción de avisos. 
Diseñar estrategias de r ...","https://trabajo.gallito.com.uy/anuncio/asistente-de-rrhh-5sm5n","montevideo",2019-10-17 16:10:35
"ASESOR DE BIENESTAR","carlos centurion","Ejecutivo Comercial","Ventas - Comercial","Hace 3 semanas ","Asesoramiento en el área de bienestar 
Negocio independiente, e internacional. Ser enseñable, proactivo , ganas de capacitarse y superarse.","https://trabajo.gallito.com.uy/anuncio/asesor-de-bienestar-gmse9","montevideo",2019-10-17 16:10:35
"ELECTRICISTA","Empresa","Técnico / Especialista","Construcción - Arquitectura","Hace 3 semanas "," 

ELECTRICISTA INDUSTRIAL



Con Habilitación de UTE

C.V Con Referencias","https://trabajo.gallito.com.uy/anuncio/electricista-r55a6","montevideo",2019-10-17 16:10:35
"AUXILIAR ADMINISTRATIVO","Importante Empresa","Auxiliar","Administración - Secretariado","Hace 3 semanas ","Objetivos generales del puesto
La posición tiene como objetivo central desarrollar las tareas en el área administrativa, destacándose entre sus principales ...","https://trabajo.gallito.com.uy/anuncio/auxiliar-administrativo-9vtgn","montevideo",2019-10-17 16:10:35
"VENDEDOR CON EXPERIENCIA EN CONSUMO MASIVO PARA CANAL TRADICIONAL","Importante empresa","Ejecutivo Comercial","Ventas - Comercial","Hace 3 semanas ","IMPORTANTE DISTRIBUIDOR DE RECONOCIDA MARCA INCORPORA POR PLAN DE EXPANSIÓN 5 VENDEDORES DE ZONA PARA CANAL TRADICIONAL, PARA MONTEVIDEO Y CIUDAD DE LA COS ...","https://trabajo.gallito.com.uy/anuncio/vendedor-con-experiencia-en-consumo-masivo-para-canal-tradicional-t2jzm","montevideo",2019-10-17 16:10:35
"OPERADOR DE SISTEMAS","Empresa","Asistente","Tecnologías de la información","Hace 3 semanas "," Operador de Sistemas                                      





Nuestro departamento de sistemas selecciona  un  operador   con los siguientes requerimien ...","https://trabajo.gallito.com.uy/anuncio/operador-de-sistemas-usq4s","montevideo",2019-10-17 16:10:35
"ADMINISTRATIVO CONTABLE","Importante empresa","Asistente","Finanzas - Contabilidad - Auditoria","Hace 3 semanas ","-LIQUIDACIONES DE SUELDOS
-CONCILIACIÓN DE CUENTAS
-CONOCIMIENTOS IMPO/EXPO
-GESTIÓN DE COBRANZAS
-FORMACIÓN CONTABLE
-CONOCIMIENTO DE COSTOS
-TAREAS ADMIN ...","https://trabajo.gallito.com.uy/anuncio/administrativo-contable-g29h2","montevideo",2019-10-17 16:10:35
"VENDEDOR/PART TIME","SALUD","Ejecutivo Comercial","Ventas - Comercial","Hace 3 semanas ","Las tareas a desempeñar se enfocan en el área de ventas. Se trabaja tanto por redes sociales como en venta directa al público.
Contamos con un gran equipo  ...","https://trabajo.gallito.com.uy/anuncio/vendedor-part-time-88uhh","montevideo",2019-10-17 16:10:35
"RECAUDADOR DE FONDOS","","Auxiliar","Teleoperadores - Call Center","Hace 3 semanas ","En qué consiste la tarea?

LLamar a diferentes personas para poder captar una donación mensual en dinero para financiar los proyectos de una organización m ...","https://trabajo.gallito.com.uy/anuncio/recaudador-de-fondos-tb2eb","montevideo",2019-10-17 16:10:35
"AUXILIAR DE VENTAS","Empresa art. deportivo","Auxiliar","Atención al cliente","Hace 3 semanas ","Asistente de ventas part time
Carga horaria dirías de lunes a viernes 5 horas y sábados 3 horas
Salario 8000 mil pesos
La búsqueda se orienta a jóvenes pro ...","https://trabajo.gallito.com.uy/anuncio/auxiliar-de-ventas-ag7ue","montevideo",2019-10-17 16:10:35
"LICENCIADOS EN ENFERMERÍA","MÉDICA URUGUAYA","Técnico / Especialista","Salud","Hace 4 semanas "," MÉDICA URUGUAYA 

CORPORACIÓN DE ASISTENCIA MÉDICA 



SOLICITA: 



     Aspirantes para cobertura de cargos suplentes de:          



Licenciados en En ...","https://trabajo.gallito.com.uy/anuncio/licenciados-en-enfermeria-bhta2","montevideo",2019-10-17 16:10:35
"CARPINTERO","Importante empresa","Técnico / Especialista","Servicios - Oficios","Hace 4 semanas ","•	Encolado y reparación de muebles.
•	Elaboración y amurado de marcos, puertas y ventanas.
•	Elaboración de pequeños muebles.
•	Montaje de muebles, equipos ...","https://trabajo.gallito.com.uy/anuncio/carpintero-erpuy","montevideo",2019-10-17 16:10:35
"FOGUISTA","Importante empresa","Oficial","Producción","Hace 4 semanas ","- Operar y mantener las Máquinas y Calderas utilizadas para la producción de energía mecánica y/o eléctrica y calefacción. 
- Lectura e interpretación corr ...","https://trabajo.gallito.com.uy/anuncio/foguista-aqp5j","montevideo",2019-10-17 16:10:35
"AYUDANTE DE COCINA","Importante empresa","Auxiliar","Hotelería - Gastronomía - Turismo","Hace 4 semanas ","Nos orientamos a la búsqueda de personas responsables, proactivas, con marcado perfil orientado al cliente, con habilidades para el trabajo en equipo, y qu ...","https://trabajo.gallito.com.uy/anuncio/ayudante-de-cocina-9224a","montevideo",2019-10-17 16:10:35
"LICENCIADO EN ENFERMERÍA","Importante empresa","Técnico / Especialista","Salud","Hace 4 semanas ","Licenciado en Enfermería, para docencia en importante escuela del sector.
Imprescindible tener mínimo un año como Licenciado y titulo certificado por M.S.P ...","https://trabajo.gallito.com.uy/anuncio/licenciado-en-enfermeria-se2t4","montevideo",2019-10-17 16:10:35
"LICENCIADO EN ENFERMERÍA","Importante empresa","Técnico / Especialista","Salud","Hace 4 semanas ","Funciones y responsabilidades
Licenciado en Enfermería, para docencia en importante escuela del sector.
Imprescindible tener mínimo un año como Licenciado  ...","https://trabajo.gallito.com.uy/anuncio/licenciado-en-enfermeria-82nsj","montevideo",2019-10-17 16:10:35
"OPERARIO","Empresa","Peon","Producción","Hace 4 semanas "," De mano para empresa textil de insumos medicos trabajo loteado 

encimado y envasado edad de 21 a 40 años","https://trabajo.gallito.com.uy/anuncio/operario-ruj26","montevideo",2019-10-17 16:10:35
"VENDEDORA MOSTRADOR","LA ESQUINA","Auxiliar","Ventas - Comercial","Hace 4 semanas ","Auxiliar de ventas,preparación de pedidos En general","https://trabajo.gallito.com.uy/anuncio/vendedora-mostrador-2bh8h","montevideo",2019-10-17 16:10:35
"INGENIERO ELECTRICO","Montelecnor","Profesional","Producción","Hace 4 semanas "," 

IMPORTANTE EMPRESA MULTINACIONAL

Selecciona:

Ingeniero Eléctrico

 

Requisitos Excluyentes:

Dinámico y Proactivo

Con fuerte enfoque a resultados

D ...","https://trabajo.gallito.com.uy/anuncio/ingeniero-electrico-bhh6z","montevideo",2019-10-17 16:10:35
"TÉCNICO EN ELECTRÓNICA","SPYMOVIL SRL","Técnico / Especialista","Producción","Hace 4 semanas ","Buscamos técnico para el mantenimiento de equipos de medición y transmisión de datos.

Perfil de formación: 
- Electrónica 
- Ingeniería
- Ingeniería tecno ...","https://trabajo.gallito.com.uy/anuncio/tecnico-en-electronica-7d99y","montevideo",2019-10-17 16:10:35
"OPERARIA DE MANO","Importante Empresa","Peon","Producción","Hace 4 semanas ",". Para empresa textil de insumos médicos, trabjo loteado, encimado y envasado. edad de 21 a 40 años.","https://trabajo.gallito.com.uy/anuncio/operaria-de-mano-hy26r","montevideo",2019-10-17 16:10:35
"VENDEDORA","Salud bienestar y calidad de vida ","Ejecutivo Comercial","Ventas - Comercial","Hace 4 semanas ","Se necesitan vendedoras jovenes comprometidas, con o sin experiencia.
Con deseo de superarse tanto en lo laboral como personal Comprometido 
Responsable
Di ...","https://trabajo.gallito.com.uy/anuncio/vendedora-9a6pm","montevideo",2019-10-17 16:10:35
"PEÓN DE DEPOSITO","Importante empresa de limpieza","Peon","Servicios - Oficios","Hace 4 semanas ","Encargarse de armar pedidos para clientes, y controlar que se envíen
Hacer reparto de productos
Preparación de productos
Mantener el orden del deposito
Tar ...","https://trabajo.gallito.com.uy/anuncio/peon-de-deposito-6sujv","montevideo",2019-10-17 16:10:35
"APRENDIZ","Importante empresa","Auxiliar","Teleoperadores - Call Center","Hace 4 semanas ","Venta telefonica TRABAJO ESTABLE
PUNTUALIDAD","https://trabajo.gallito.com.uy/anuncio/aprendiz-5794n","montevideo",2019-10-17 16:10:35
"ATENCIÓN MOSTRADOR","","Auxiliar","Atención al cliente","Hace 4 semanas ","Sexo masculino excluyente. Buena presencia, excelente trato con el público. Se valorará experiencia en avícola o carnicería y experiencia en sistema scannt ...","https://trabajo.gallito.com.uy/anuncio/atencion-mostrador-h7tqb","montevideo",2019-10-17 16:10:35
"PEÓN","Avicola","Peon","Producción","Hace 4 semanas ","Importante avícola busca peón con libreta de conducir para camión, es imprescindible experiencia en producción, se valorará experiencia en el  rubro, no ex ...","https://trabajo.gallito.com.uy/anuncio/peon-eneq9","montevideo",2019-10-17 16:10:35
"TÉCNICO EN AIRE ACONDICIONADO","AireAcondicionado","Técnico / Especialista","Construcción - Arquitectura","Hace 4 semanas ","Instalación de equipos de aire acondicionado, atención de reclamos, eventual realización de servicios de mantenimiento preventivo de equipos de aire acondi ...","https://trabajo.gallito.com.uy/anuncio/tecnico-en-aire-acondicionado-34n74","montevideo",2019-10-17 16:10:35
"CLIENT SOLUTIONS MANAGER - FACEBOOK SALES PARTNER","Cisneros Interactive Uruguay","Técnico / Especialista","Consultoría","Hace 4 semanas ","The Client Solutions Manager for Cisneros Interactive Facebook’s Marketing Solutions team is a strategic and enthusiastic solution-driver who puts our cust ...","https://trabajo.gallito.com.uy/anuncio/client-solutions-manager-facebook-sales-partner-r69pa","montevideo",2019-10-17 16:10:35
"REDES DE MERCADO","Importante empresa","Supervisor / Encargado","Administración - Secretariado","Hace 1 mes ","Desarrollo de redes de Consumo de Productos de Nutrición. Proactividad
Desarrollo personal
Ventas
Liderazgo","https://trabajo.gallito.com.uy/anuncio/redes-de-mercado-va269","montevideo",2019-10-17 16:10:35
"TURNO NOCHE SERENO JUBILADO PARA PARKING. AT. CLIENTE. MANEJO VEHÍCULOS","BT PERFORMANCE","Peon","Servicios - Oficios","Hace 1 mes ","SE BUSCA HOMBRE JUBILADO PARA TRABAJAR TURNO NOCHE EN ESTACIONAMIENTO . ZONA POCITOS
QUE MANEJE MUY BIEN .
SE TRABAJA FINES DE SEMANA
SE LIBRA DÍA DE SEMAN ...","https://trabajo.gallito.com.uy/anuncio/turno-noche-sereno-jubilado-para-parking-at-cliente-manejo-vehiculos-v3ntd","montevideo",2019-10-17 16:10:35
"RESPONSABLE DE CUENTAS CORRIENTES","Importante empresa","Asistente","Finanzas - Contabilidad - Auditoria","Hace 1 mes ","Entre sus principales responsabilidades estarán el seguimiento y gestión de las cuentas a cobrar, autorización de créditos, contacto con los clientes Las p ...","https://trabajo.gallito.com.uy/anuncio/responsable-de-cuentas-corrientes-mpnam","montevideo",2019-10-17 16:10:35
"ATENCIÓN AL CLIENTE Y VENTAS","Importante empresa","Auxiliar","Teleoperadores - Call Center","Hace 1 mes ","Jóvenes emprendedores de 18 a 33 años con deseo de superación, manejo de redes sociales, pro activos, brindamos capacitaciones constantes, ganancias diaria ...","https://trabajo.gallito.com.uy/anuncio/atencion-al-cliente-y-ventas-v9h7e","montevideo",2019-10-17 16:10:35
"TÉCNICO CONSULTOR EN SOFTWARE","Proyectos Ingenieria","Técnico / Especialista","Tecnologías de la información","Hace 1 mes ","- Consultor técnico. Instalación, capacitación a cliente, soporte técnico, etc., respecto de módulos de software pertenecientes a la empresa, así como de s ...","https://trabajo.gallito.com.uy/anuncio/tecnico-consultor-en-software-heh2r","montevideo",2019-10-17 16:10:35
"VENDEDOR PARA DISTRIBUIDOR MAYORISTA","Importante empresa","Ejecutivo Comercial","Ventas - Comercial","Hace 1 mes ","Distribuidor Mayorista selecciona personal para su sector comercial.

La busqueda esta orientada a persona con alta capacidad de negociacion, marcado perfi ...","https://trabajo.gallito.com.uy/anuncio/vendedor-para-distribuidor-mayorista-dyhys","montevideo",2019-10-17 16:10:35
"VENTAS- DISPONIBILIDAD HORARIA","Belle Menti","Ejecutivo Comercial","Ventas - Comercial","Hace 1 mes ","Se solicitan jóvenes de 20 a 30 años, responsables , puntuales,  buen manejo de redes sociales e internet. 
Ganancias diarias, quincenales , bonos de diner ...","https://trabajo.gallito.com.uy/anuncio/ventas-disponibilidad-horaria-qvpmj","montevideo",2019-10-17 16:10:35
"VENDEDORES","LUMAC","Ejecutivo Comercial","Ventas - Comercial","Hace 1 mes ","Buscamos jóvenes , con gusto por las ventas, buena actitud, buena presencia, comprometidos y responsables.
El trabajo se gestiona a través de redes sociale ...","https://trabajo.gallito.com.uy/anuncio/vendedores-24eb7","montevideo",2019-10-17 16:10:35
"VENDEDORES - PART TIME/ FULL TIME","Importante empresa","Auxiliar","Atención al cliente","Hace 1 mes ","Nos encontramos en busca de jóvenes con carácter emprendedor para el área de ventas, con vocación de servicio en atención y asesoramiento al cliente. 
Hora ...","https://trabajo.gallito.com.uy/anuncio/vendedores-part-time-full-time-r2asg","montevideo",2019-10-17 16:10:35
"VENDODRA EN MOSTRADOR CON EXPERIENCIA EN HELADERÍA ARTESANAL","Importante empresa","Auxiliar","Atención al cliente","Hace 1 mes ","atención en la venta al público en mostrador  en heladería artesanal  y mantenimiento del local, cuidados de las maquinas e higiene del local.Buscamos una  ...","https://trabajo.gallito.com.uy/anuncio/vendodra-en-mostrador-con-experiencia-en-heladeria-artesanal-2dhvg","montevideo",2019-10-17 16:10:35
"DELIVERY","Mr delivery","Auxiliar","Cadetería - Cobranzas","Hace 1 mes ","Se necesita cadete con moto para tareas de delivery. Con libreta y moto en buen estado Se necesita delivery para fin de semana .para toda la semana . zona  ...","https://trabajo.gallito.com.uy/anuncio/delivery-36j9p","montevideo",2019-10-17 16:10:35
"CHOFER REPARTIDOR.","chacra bilu","Peon","Servicios - Oficios","Hace 1 mes ","CHACRA BILU BUSCA A LOS MEJORES Chóferes repartidores con libreta A, B o C únicamente 
Vehículos nuevos con Furgón refrigerado 

edad de 25 a 40 años para  ...","https://trabajo.gallito.com.uy/anuncio/chofer-repartidor-v36hu","montevideo",2019-10-17 16:10:35
"VENTA PROFESIONAL / PART O FULL TIME","LUMAC","Ejecutivo Comercial","Ventas - Comercial","Hace 1 mes ","Buscamos jóvenes , con gusto por las ventas, buena actitud, buena presencia, comprometidos y responsables.
El trabajo se gestiona a través de redes sociale ...","https://trabajo.gallito.com.uy/anuncio/venta-profesional-part-o-full-time-ghg5r","montevideo",2019-10-17 16:10:35
"APRENDIZ ADELANTADO /MEDIO OFICIAL","ELEVAR","Técnico / Especialista","Producción","Hace 1 mes ","mantenimiento y reparacion de autoelevadores y maquinaria afin las propias del puesto siendo supervisado en la orden dada y calidad del rabajo","https://trabajo.gallito.com.uy/anuncio/aprendiz-adelantado-medio-oficial-qu6ng","montevideo",2019-10-17 16:10:35
"JEFE DE SEGURIDAD - MONTEVIDEO FULL TIME","Importante empresa","Jefe","Seguridad - Vigilancia","Hace 1 mes ","Se busca incorporar al equipo un Jefe de Seguridad

Masculino mayor de 40 años
Formación en la rama de la seguridad (se valorará si es retirado militar con ...","https://trabajo.gallito.com.uy/anuncio/jefe-de-seguridad-montevideo-full-time-vpd9p","montevideo",2019-10-17 16:10:35
"PROMOTORA","","Ejecutivo Comercial","Ventas - Comercial","Hace 1 mes ","Buscamos personas para integrarse en equipos puerta a puerta de prestigiosa empresa del rubro didáctico editorial con 50 años de trayectoria. Requisitos:

 ...","https://trabajo.gallito.com.uy/anuncio/promotora-pn5nv","montevideo",2019-10-17 16:10:35
"TECNICO EN INFORMÁTICA Y CCTV (CON EXPERIENCIA)","Importante empresa","Técnico / Especialista","Tecnologías de la información","Hace 1 mes ","Reparación de artículos de informática
Reparación de artículos de CCTV
Soporte técnico a clientes
Soporte técnico a vendedores Técnico del RMA de la empres ...","https://trabajo.gallito.com.uy/anuncio/tecnico-en-informatica-y-cctv-con-experiencia-d88ay","montevideo",2019-10-17 16:10:35
"SECRETARIA","RECON SECURITY","Auxiliar","Administración - Secretariado","Hace 1 mes ","Llevar la documentación, control de horas del personal,cadeteria puntuallidad, proactividad, trabajo en equipo","https://trabajo.gallito.com.uy/anuncio/secretaria-qvpqe","montevideo",2019-10-17 16:10:35
"COCINERA PARA RESIDENCIAL","Importante empresa","Técnico / Especialista","Hotelería - Gastronomía - Turismo","Hace 1 mes ","Cocinera para residencial 3ra edad con experiencia en cocina de residenciales y Carne salud vigente. Turno matutino 07 a 15. Sueldo mensual en mano $22.500 ...","https://trabajo.gallito.com.uy/anuncio/cocinera-para-residencial-pgh9h","montevideo",2019-10-17 16:10:35
"ASESOR COMERCIAL","Empresa que inicia actividades","Ejecutivo Comercial","Ventas - Comercial","Hace 1 mes ","Para venta de papeles adhesivos de decoración, presencial y por Internet.
Persona desenvuelta, con experiencia en ventas y manejo redes sociales. Responsab ...","https://trabajo.gallito.com.uy/anuncio/asesor-comercial-r3jbh","montevideo",2019-10-17 16:10:35
"ASISTENTE DENTAL","Odontologo zona Cordón","Profesional","Salud","Hace 1 mes ","Asistente Dental para Consultorio Odontógico (Zona Cordón) con experiencia mínima de 1 año en tareas afines.
Egresada como Asistente Dental o estudiante de ...","https://trabajo.gallito.com.uy/anuncio/asistente-dental-b46pp","montevideo",2019-10-17 16:10:35
"EMPRENDEDORAS VENDEDORAS","Equipo IV","Ejecutivo Comercial","Ventas - Comercial","Hace 1 mes ","Abierto a querer aprender fundamental, Capacitación, Atención al Cliente, Brindar Información, dar asesoramiento, recomendar, cerrar la Venta, realizar Ven ...","https://trabajo.gallito.com.uy/anuncio/emprendedoras-vendedoras-48haq","montevideo",2019-10-17 16:10:35
"VENDEDORES / AS","Importante empresa","Ejecutivo Comercial","Ventas - Comercial","Hace 1 mes ","Entre las tareas a desempeñar se encuentran:
-Ventas via web (redes sociales) y presenciales. 
-Asesoramiento al cliente sobre los productos que comerciali ...","https://trabajo.gallito.com.uy/anuncio/vendedores-as-uzzg3","montevideo",2019-10-17 16:10:35
"OPERADOR DE CENTRAL DE MONITOREO Y CCTV - CARRASCO","","Auxiliar","Seguridad - Vigilancia","Hace 1 mes ","Se busca incorporar al equipo un OPERADOR para central de MONITOREO y CCTV para empresa de Seguridad con experiencia comprobable en manejos de sistemas inf ...","https://trabajo.gallito.com.uy/anuncio/operador-de-central-de-monitoreo-y-cctv-carrasco-8rq5b","montevideo",2019-10-17 16:10:35
"DISEÑADORA TEXTIL","cattos srl","Técnico / Especialista","Arte - Diseño - Comunicación","Hace 1 mes ","Con amplia experiencia laboral en audaces, molderia y progresion y diseño grafico Armado de dos colecciones completas al año para hombre, dama, niño y niña ...","https://trabajo.gallito.com.uy/anuncio/disenadora-textil-ag5te","montevideo",2019-10-17 16:10:35
"RESPONSABLE DE COMPRAS Y SUPPLY","KPMG","Supervisor / Encargado","Administración - Secretariado","Hace 1 mes ","Conocimientos técnicos
•	Profesionales egresados de carreras vinculadas (Contador Público, Administración de empresas, Logística, Ingeniería, entre otras)
 ...","https://trabajo.gallito.com.uy/anuncio/responsable-de-compras-y-supply-gdy6m","montevideo",2019-10-17 16:10:35
"PREPARADOR DE PINTURA","OPERMAR SA","Medio Oficial","Producción","Hace 1 mes ","- Buscamos persona responsable, seria y organizada
- Buen ambiente laboral
- Horario de Lunes a Viernes 8 hrs y Sabados 4 hrs
- Puesto de preparador y auxi ...","https://trabajo.gallito.com.uy/anuncio/preparador-de-pintura-h32b8","montevideo",2019-10-17 16:10:35
"NEGOCIO INDEPENDIENTE","Empresa Multinacional","Ejecutivo Comercial","Ventas - Comercial","Hace 1 mes ","Buscamos personas proactivas interesadas en generar ingresos adicionales a su actividad comercial actual. Armar Redes de Distribución","https://trabajo.gallito.com.uy/anuncio/negocio-independiente-mh4a7","montevideo",2019-10-17 16:10:35
"PROFESOR","A Plus","Profesional","Educación - Recreación - Deportes","Hace 1 mes ","Profesor de matemáticas. 
Profesor de física. Clases individuales","https://trabajo.gallito.com.uy/anuncio/profesor-eejuq","montevideo",2019-10-17 16:10:35
"ASESOR & BUSSINESS DEVELOPER","CONVIXION","Ejecutivo Comercial","Ventas - Comercial","Hace 1 mes ","Queremos sumar a nuestro equipo de trabajo personas que se cautiven con nuestro proyecto y quieran ser parte de el.
¿Cómo? Disfrutando de lo que hacen y ha ...","https://trabajo.gallito.com.uy/anuncio/asesor-bussiness-developer-hb8j2","montevideo",2019-10-17 16:10:35
"AYUDANTE COMPRADOR DE FRUTAS VERDURAS","","Peon","Producción","Hace 1 mes ","Importante distribuidora de Frutas y Hortalizas
busca jovenes activos ágiles y dinámicos con conocimiento en el mercado para acarrear mercadería desde el m ...","https://trabajo.gallito.com.uy/anuncio/ayudante-comprador-de-frutas-verduras-9mj95","montevideo",2019-10-17 16:10:35
"NEGOCIO PROPIO","GANE LO QUE MERECES","Ejecutivo Comercial","Ventas - Comercial","Hace 1 mes ","TE GUSTARÍA GENERAR INGRESOS ADICIONALES SIN DESCUIDAR TU TRABAJO ACTUAL? INGRESOS INMEDIATOS TRABAJANDO DESDE SU CASA. SOMOS LA EMPRESA  DE MERCADEO EN RE ...","https://trabajo.gallito.com.uy/anuncio/negocio-propio-8ujtm","montevideo",2019-10-17 16:10:35
"CHOFER REPARTIDOR.","chacra bilu","Peon","Servicios - Oficios","Hace 1 mes ","CHACRA BILU BUSCA A LOS MEJORES Chóferes repartidores con libreta A, o C únicamente 
Vehículos nuevos con Furgón refrigerado 

edad de 25 a 40 años para im ...","https://trabajo.gallito.com.uy/anuncio/chofer-repartidor-7mmnq","montevideo",2019-10-17 16:10:35
"GUARDIA","REFERENT SECURITY","Auxiliar","Seguridad - Vigilancia","Hace 1 mes ","Se ofrece:
- Ingreso de forma inmediata. Requisitos excluyentes:
-Imprescindible: 
-Haber sido guardia de seguridad.
-Conocimiento de calles
- Masculino
-  ...","https://trabajo.gallito.com.uy/anuncio/guardia-g9eyp","montevideo",2019-10-17 16:10:35
"AUXILIAR ADMINISTRATIVO DE VENTAS","Frigorífico Pesquero","Auxiliar","Ventas - Comercial","Hace 1 mes ","Trabajará directamente en el sector de ventas
Amplia experiencia en facturación, control de cuentas de clientes, gestión de cobranza, archivo y tareas admi ...","https://trabajo.gallito.com.uy/anuncio/auxiliar-administrativo-de-ventas-ng7gg","montevideo",2019-10-17 16:10:35
"AUXILIAR ADMINISTRATIVO CONTABLE","Frigorífico Pesquero","Asistente","Finanzas - Contabilidad - Auditoria","Hace 1 mes ","Conciliaciones bancarias
Conciliación y análisis de cuentas de deudores y acreedores
Registro de documentación
Preparación de cuentas para el balance
Liqui ...","https://trabajo.gallito.com.uy/anuncio/auxiliar-administrativo-contable-6yu2j","montevideo",2019-10-17 16:10:35
"CAJERO/A PARA MINIMERCADO","Importante empresa","Auxiliar","Ventas - Comercial","Hace 1 mes ","Nos orientamos a la búsqueda de personas responsables, confiables, proactivas y con marcado perfil orientado al cliente.
Para caja de Minimercado de Estaci ...","https://trabajo.gallito.com.uy/anuncio/cajero-a-para-minimercado-65q2e","montevideo",2019-10-17 16:10:35
"VENDEDOR/PART TIME","SALUD","Ejecutivo Comercial","Ventas - Comercial","Hace 1 mes ","Las tareas a desempeñar se enfocan en el área de ventas. Se trabaja tanto por redes sociales como en venta directa al público.
Contamos con un gran equipo  ...","https://trabajo.gallito.com.uy/anuncio/vendedor-part-time-turmh","montevideo",2019-10-17 16:10:35
"ASISTENTE A LA GERENCIA DE PRODUCCIÓN","Importante empresa Industrial","Auxiliar","Producción","Hace 1 mes ","•	Apoyar los supervisores en todas las tareas de producción y mantenimiento.
•	Obtención de indicadores de producción
•	Elaboración de reportes de producci ...","https://trabajo.gallito.com.uy/anuncio/asistente-a-la-gerencia-de-produccion-v6pm9","montevideo",2019-10-17 16:10:35
"TURNO DIURNO Y NOCTURNO","Empresa Fmiliar","Peon","Servicios - Oficios","Hace 1 mes ","Choferes para taximetros turnos diurno y nocturnos. 
Relevo puerta a puerta mas beneficios extras. .","https://trabajo.gallito.com.uy/anuncio/turno-diurno-y-nocturno-z6r86","montevideo",2019-10-17 16:10:35
"TELEMARKETER","Importante empresa","Auxiliar","Teleoperadores - Call Center","Hace 1 mes ","Nos encontramos en la búsqueda de personas con marcado perfil comercial y experiencia en ventas (preferentemente telefónica), que contribuyan a la comercia ...","https://trabajo.gallito.com.uy/anuncio/telemarketer-a8ze8","montevideo",2019-10-17 16:10:35
"AUXILIAR DE DEPOSITO","Importante empresa","Auxiliar","Logística - Distribución","Hace 1 mes ","libreta de conducir  imprescindible 
Preparar pedidos 
Hacer stock 
Libreta de conducir Deposito","https://trabajo.gallito.com.uy/anuncio/auxiliar-de-deposito-a9uba","montevideo",2019-10-17 16:10:35
