"puesto","empresa","nivel","area","fecha","detalle","dpto","link","fecha_scraping"
"VENDEDOR DISTRIBUIDOR INDEPENDIENTE","Importante empresa","Ejecutivo Comercial","Ventas - Comercial","Hace 1 mes ","Eres vendedor y te gusta crear nuevos estilos de ventas? Entonces eres la persona indicada para este nuevo proyecto . Nuestros productos necesitan de algui ...","montevideo","/anuncio/vendedor-distribuidor-independiente-dybve",2019-06-17 17:38:12
"APRENDIZ PARA EL RUBRO CARPINTERÍA DE MADERA","Importante empresa","Peon","Producción","Hace 1 mes ","- Joven con buena presencia para iniciarse en el rubro carpintería de madera.  - Se considerara experiencia previa y conocimientos del rubro. -","montevideo","/anuncio/aprendiz-para-el-rubro-carpinteria-de-madera-dsbqy",2019-06-17 17:38:12
"ENCARGADO DE VENTAS","Importante empresa de ventas internacional","Ejecutivo Comercial","Ventas - Comercial","Hace 1 mes ","Ventas a través de plataformas web, vía telefónica y presencial, asesoramiento personalizado, cuidado de la cartera de clientes. Honestidad, respeto, puntu ...","montevideo","/anuncio/encargado-de-ventas-z4pqu",2019-06-17 17:38:12
"WEB DEVELOPER JR","TowerHouseStudio","Analista","Tecnologías de la información","Hace 1 mes ","Buscamos programador web junior con conocimientos basicos de programacion web que tenga ganas de aprender mientras trabaja.  El candidato ideal estara curs ...","montevideo","/anuncio/web-developer-jr-2z274",2019-06-17 17:38:12
"VENDEDOR VIAJANTE - ADITIVOS Y LUBRICANTES","Importante empresa","Ejecutivo Comercial","Ventas - Comercial","Hace 1 mes ","Nos encontramos en la búsqueda de personas proactivas y responsables con marcado perfil orientado a las ventas, para el cargo de vendedor viajante de aditi ...","montevideo","/anuncio/vendedor-viajante-aditivos-y-lubricantes-bjhyz",2019-06-17 17:38:12
"CARPINTERO INSTALADOR PARA EL RUBRO CARPINTERÍA, CON EXPERIENCIA","Importante empresa","Oficial","Producción","Hace 1 mes ","- Carpintero instalador con experiencia comprobable y referencias laborales!!!! - Con vehículo propio. - Libreta de conducir, como mínimo categoría A.  - B ...","montevideo","/anuncio/carpintero-instalador-para-el-rubro-carpinteria-con-experiencia-ymed2",2019-06-17 17:38:12
"AUXILIAR PARA TRAMITES (GESTOR/A) PART-TIME","Torres y Asociados Contadores Públicos","Auxiliar","Cadetería - Cobranzas","Hace 1 mes ","Seleccionamos Auxiliar para Trámites externos e internos (Gestor/a). La Persona deberá ser proactiva, con buen relacionamiento interpersonal, capaz de tra ...","montevideo","/anuncio/auxiliar-para-tramites-cadete-part-time-q3bsh",2019-06-17 17:38:12
"VENDEDORA","AAC","Ejecutivo Comercial","Ventas - Comercial","Hace 1 mes ","Se necesitan Vendedoras de 18 a 33 años con o sin experiencia. Horario Part-Time o Full-Time. Responsable Comprometido  Buena Presencia  Dinámico","montevideo","/anuncio/vendedora-evqg6",2019-06-17 17:38:12
"OFICIAL CARPINTERO PARA EL RUBRO MADERA, CON EXPERIENCIA","Importante empresa","Oficial","Producción","Hace 1 mes ","- Oficial carpintero para el rubro madera con experiencia comprobable!!!! para trabajos en taller y en obras. - Buena presencia y referencia laborales. - C ...","montevideo","/anuncio/oficial-carpintero-para-el-rubro-madera-con-experiencia-jn697",2019-06-17 17:38:12
"VENDEDOR POR REDES SOCIALES","HELSSE","Ejecutivo Comercial","Ventas - Comercial","Hace 1 mes ","Somos una empresa de nivel internacional. Necesitamos gente con o sin experiencia de 18 a 30 años, emprendedoras, pro-activas y con liderazgo. Buscamos per ...","montevideo","/anuncio/vendedor-por-redes-sociales-6uau3",2019-06-17 17:38:12
"AUXILIAR ADMINISTRATIVO","Importante empresa","Auxiliar","Administración - Secretariado","Hace 1 mes ","En colón, empresa editorial selecciona persona para incorporarse a la administración para realizar ingreso de datos al sistema propio y atención telefónica ...","montevideo","/anuncio/auxiliar-administrativo-6hqrb",2019-06-17 17:38:12
"ADMINISTRATIVA","Importante empresa","Auxiliar","Administración - Secretariado","Hace 1 mes ","- Gestión, administración y organización de los documentos de la empresa - Facturación - Pago a proveedores - Control de Stock - Conciliación Bancaria - Tr ...","montevideo","/anuncio/administrativa-7mu44",2019-06-17 17:38:12
"ENCARGADO DE SYSO","Importante empresa","Técnico / Especialista","Recursos Humanos","Hace 1 mes ","Importante Empresa, requiere incorporar a su equipo, un/a Encargado/a de SYSO. Sus principales funciones serán: Ejecutar, gestionar y difundir las distinta ...","montevideo","/anuncio/encargado-de-syso-zn825",2019-06-17 17:38:12
"OPERARIA ACONDICIONAMIENTO SECUANDARIO","UNIMEDICAL DEL URUGUAY LTDA","Peon","Producción","Hace 1 mes ","Tareas de acondicionamiento secundario , etiquetado , acondionamiento de blister e inyectables . Pasado por InJect . Flejeo  Es imprescindible experiencia  ...","montevideo","/anuncio/operaria-acondicionamiento-secuandario-2p4t6",2019-06-17 17:38:12
"GESTOR DE COBRANZA DE 15 A 21 HS.","MAGACUGUI","Auxiliar","Teleoperadores - Call Center","Hace 1 mes ","Buscamos jóvenes universitarios con excelentes habilidades para la comunicación.  Horario part time de lunes a viernes. Excluyente tener disponibilidad p ...","montevideo","/anuncio/gestor-de-cobranza-de-15-a-21-hs-qbejv",2019-06-17 17:38:12
"AUXILIAR ADMINISTRATIVO","Importante empresa","Auxiliar","Administración - Secretariado","Hace 1 mes ","Nos encontramos en la búsqueda de personas responsables y proactivas, que se encuentren cursando estudios universitarios de administración de empresas o ca ...","montevideo","/anuncio/auxiliar-administrativo-veran",2019-06-17 17:38:12
"JEFE DE MANTENIMIENTO SENIOR","Para Grupo Ta-Ta","Jefe","Producción","Hace 1 mes ","¿Quieres el desafío? La posición tendrá a su cargo la planificación, coordinación y gestión de los trabajos de mantenimiento preventivo, predictivo y corr ...","montevideo","/anuncio/jefe-de-mantenimiento-senior-d4zn7",2019-06-17 17:38:12
"RECAUDADOR DE FONDOS","Teleservicios","Auxiliar","Teleoperadores - Call Center","Hace 1 mes ","Qué buscamos? _Experiencia en Ventas y/o Call Center _Habilidades de negociación y manejo de objeciones  _Interés por el área social y comunitaria _Valora ...","montevideo","/anuncio/recaudador-de-fondos-65dgt",2019-06-17 17:38:12
"VENDEDOR","ADT Security Services, multinacional líder en el rubro de Seguridad","Ejecutivo Comercial","Ventas - Comercial","Hace 1 mes ","ADT Security Services, multinacional líder en el rubro de Seguridad, con más de 130 años de experiencia y presencia en más de 100 países, busca a LOS MEJOR ...","montevideo","/anuncio/vendedor-d6rhg",2019-06-17 17:38:12
"ELEVADORISTA - OPERARIO DE DEPÓSITO","EMPRESA NACIONAL","Auxiliar","Logística - Distribución","Hace 1 mes ","Buscamos un Operario de Depósito con experiencia comprobada en manejo de autoelevadores para el trabajo con mercaderías. Experiencia en depósito, preparaci ...","montevideo","/anuncio/elevadorista-operario-de-deposito-d9n69",2019-06-17 17:38:12
"TURNO DIURNO Y NOCTURNO","Empresa Fmiliar","Peon","Servicios - Oficios","Hace 1 mes ","Choferes para taximetros turnos diurno y nocturnos.  Relevo puerta a puerta mas beneficios extras. .","montevideo","/anuncio/turno-diurno-y-nocturno-drbme",2019-06-17 17:38:12
"AUXILIAR CONTABLE CALIFICADA",NA,"Asistente","Finanzas - Contabilidad - Auditoria","Hace 1 mes ","aux,Contable calificada con experiencia en programas memory y personal GNS para empresa horario completo de lunes a viernes 10 a 19 hS experiencia en progr ...","montevideo","/anuncio/auxiliar-contable-calificada-hummn",2019-06-17 17:38:12
"VENDEDOR PISTA Y LAVADOR","Importante empresa","Auxiliar","Atención al cliente","Hace 1 mes ","Nos orientamos a la búsqueda de personas responsables, proactivas y con marcado perfil orientado al cliente,para estación de servicio ubicada en zona CARRA ...","montevideo","/anuncio/vendedor-pista-y-lavador-28udn",2019-06-17 17:38:12
"INSTALADOR/AYUDANTE","Empresa Sistemas de seguridad electronica","Oficial","Servicios - Oficios","Hace 1 mes ","Instalación reparación y servicio de sistemas de alarmas y cámaras Empleado calificado","montevideo","/anuncio/instalador-ayudante-sthby",2019-06-17 17:38:12
"VENDEDOR /A","Nutrición para todos","Ejecutivo Comercial","Ventas - Comercial","Hace 1 mes ","Jóvenes emprendedores de 18 a 33 años con deseo de superación, manejo de redes sociales, pro activos, brindamos capacitaciones constantes, ganancias diaria ...","montevideo","/anuncio/vendedor-a-udtj5",2019-06-17 17:38:12
"ADMINISTRATIVO CONTABLE","Empresa","Asistente","Finanzas - Contabilidad - Auditoria","Hace 1 mes ","Empresa de zona oeste de Montevideo busca Auxiliar Contable part time Requisitos: •	Estudiante de Ciencias Económicas con Contabilidad de segundo año aprob ...","montevideo","/anuncio/administrativo-contable-d8eem",2019-06-17 17:38:12
"VENDEDOR CALL CENTER","Importante empresa","Auxiliar","Teleoperadores - Call Center","Hace 1 mes ","Buscamos jóvenes para realizar ventas telefónicas del rubro Telefonía móvil. Ingresos base fija + comisiones sin base + incentivos por objetivos que harán  ...","montevideo","/anuncio/vendedor-call-center-dr2at",2019-06-17 17:38:12
"VENDEDOR DE CALLE",NA,"Ejecutivo Comercial","Ventas - Comercial","Hace 1 mes ","Somos una empresa de telefonía móvil. Buscamos una persona para ventas de calle a clientes de la cartera de la empresa. Buena presencia, excelente atención ...","montevideo","/anuncio/vendedor-de-calle-8d8sz",2019-06-17 17:38:12
"VENDEDOR DE CALLE","Importante Empresa","Ejecutivo Comercial","Ventas - Comercial","Hace 1 mes ","Buscamos jóvenes entusiastas, carismáticos para venta en la calle de productos del rubro telefonía móvil. Buena presencia, buena disposición y ganas de tra ...","montevideo","/anuncio/vendedor-call-center-9zagt",2019-06-17 17:38:12
"SUPERVISOR DE LIMPIEZA","Global Higiene","Auxiliar","Servicios - Oficios","Hace 1 mes ","Las principales tareas serán: *Supervisar el cronograma de actividades relativo a limpieza de acuerdo a los servicios y espacios de la Torre, proponer mejo ...","montevideo","/anuncio/supervisor-de-limpieza-daeb9",2019-06-17 17:38:12
"PROGRAMADOR PHP SEMI-SENIOR","Importante empresa","Analista","Tecnologías de la información","Hace 1 mes ","Buscamos desarrollador PHP semi- senior para desarrollo de proyecto web en un período de entre 3 y 5 meses.  Las tecnologías a utilizar serán: - PHP - MyS ...","montevideo","/anuncio/programador-php-semi-senior-5gt4d",2019-06-17 17:38:12
"EJECUTIVO COMERCIAL / VENDEDOR","Importante empresa","Ejecutivo Comercial","Ventas - Comercial","Hace 1 mes ","Empresa representante oficial de marca del rubro informático En busca de un Ejecutivo Comercial para el área corporativa y/o ventas al estado.  Favor de e ...","montevideo","/anuncio/ejecutivo-comercial-vendedor-mmbay",2019-06-17 17:38:12
"ACOMPAÑANTE DE REPARTO C/ LIBRETA PROFESIONAL CAMIÓN","Importante empresa","Peon","Producción","Hace 1 mes ","Buscamos un acompañante de Reparto para Empresa del Rubro Alimentos con experiencia (excluyente) en manejo de camión (Categoría C o D), para realizar tarea ...","montevideo","/anuncio/acompanante-de-reparto-c-libreta-profesional-camion-259qq",2019-06-17 17:38:12
"DELIVERY CON MOTO Y LIBRETA","Importante empresa","Auxiliar","Cadetería - Cobranzas","Hace 1 mes ","Se necesita cadete con moto y libreta  varias zonas muy bien paga la hora. zonas buceo. Centro.  carrasco.  pocitos  fines de semana.  dia y noche","montevideo","/anuncio/delivery-con-moto-y-libreta-j9dty",2019-06-17 17:38:12
"CADETE FEMENINO","URUTAXI","Auxiliar","Cadetería - Cobranzas","Hace 1 mes ","CADETERÍA Y COBRANZAS CADETE FEMENINO CON LIBRETA DE MOTO (EXCLUYENTE) PARA TALLER MECÁNICO ","montevideo","/anuncio/cadete-femenino-ztbe9",2019-06-17 17:38:12
"VENDEDOR DE MOSTRADOR EN TIENDA DE ARTÍCULOS PARA EL HOGAR","Importante empresa","Auxiliar","Atención al cliente","Hace 1 mes ","Joven con vocación de ventas para mostrador. Tienda de artículos para el hogar en zona Cordón. Buena Presencia. Puntualidad y asistencia","montevideo","/anuncio/vendedor-de-mostrador-en-tienda-de-articulos-para-el-hogar-u56p6",2019-06-17 17:38:12
"VENDEDOR/A","Salud bienestar y dinero ","Ejecutivo Comercial","Ventas - Comercial","Hace 1 mes ","Jóvenes emprendedores de 18 a 33 años con deseo de superación, manejo de redes sociales, pro activos, brindamos capacitaciones constantes, ganancias diaria ...","montevideo","/anuncio/vendedor-a-hsz9h",2019-06-17 17:38:12
"VENDEDOR,CAJERO,ENCARGADO LAS PIEDRAS SHOPPING","Importante empresa","Ejecutivo Comercial","Ventas - Comercial","Hace 1 mes ","Importante empresa del rubro de vestimenta selecciona Vendedoras,cajeras Encargadas.  Preferentemente mayor a 22 años, bachillerato completo (no excluyente ...","montevideo","/anuncio/vendedor-cajero-encargado-las-piedras-shopping-arzem",2019-06-17 17:38:12
"MUCAMA PARA HOTEL CENTRICO, HORARIO ROTATIVO- 35 A 50 AÑOS","HOTEL CENTRICO","Auxiliar","Hotelería - Gastronomía - Turismo","Hace 1 mes ","Limpieza de habitaciones, lavadero, planchado de ropa, atencion al pasajero, llevar pedidos, armar cafeteria , elaboracion de sandwiches, desayunos, etc no ...","montevideo","/anuncio/mucama-para-hotel-centrico-horario-rotativo-daqmu",2019-06-17 17:38:12
"VENDEDORA","Cuidemos nuestra salud","Ejecutivo Comercial","Ventas - Comercial","Hace 1 mes ","Se necesitan Vendedoras de 18 a 33 años con o sin experiencia. Horario Part-Time o Full-Time. Responsable Comprometido  Buena Presencia  Dinámico","montevideo","/anuncio/vendedora-2rp92",2019-06-17 17:38:12
"VENTAS",NA,"Ejecutivo Comercial","Ventas - Comercial","Hace 1 mes ","ESTAMOS BUSCANDO PERSONAS EMPRENDEDORAS QUE ESTÉN INSATISFECHAS CON SUS INGRESOS ACTUALES Y QUE QUIERAN DESARROLLAR UN NEGOCIO INDEPENDIENTE TRABAJANDO DES ...","montevideo","/anuncio/ventas-n3z4u",2019-06-17 17:38:12
"MECANICO DE MOTOS","Importante empresa","Técnico / Especialista","Producción","Hace 1 mes ","Buscamos personas con título de Técnico Mecánico, específicamente en Mecánica de Motos, con sólido perfil enfocado en la Atención de Clientes, capaz de int ...","montevideo","/anuncio/mecanico-de-motos-s62zq",2019-06-17 17:38:12
"VENTAS - DISPONIBILIDAD HORARIA","Importante empresa","Ejecutivo Comercial","Ventas - Comercial","Hace 1 mes ","Se solicitan jovenes de 20 a 30 años,  responsables, puntuales, buen manejo de redes sociales e internet.  Ganancias diarias, quincenales, bonos de dinero  ...","montevideo","/anuncio/ventas-disponibilidad-horaria-vrvda",2019-06-17 17:38:12
"VENDEDORES/AS PARA REDES SOCIALES","EME EMPRENDIMIENTO ","Ejecutivo Comercial","Ventas - Comercial","Hace 1 mes ","Somos una empresa de ventas directas donde formamos a profesionales de la venta. Ofrecemos capacitaciones constante  Ganancias Diarias  Quincenales  Bonos  ...","montevideo","/anuncio/vendedores-as-para-redes-sociales-883st",2019-06-17 17:38:12
"REPONEDOR EXTERNO CON LIBRETA","Importante empresa","Auxiliar","Ventas - Comercial","Hace 1 mes ","Los postulantes tienen que tener libreta de moto o de auto. Los que tengan libreta de moto, también deben contar con moto propia. Recorrerán los comercios  ...","montevideo","/anuncio/reponedor-externo-con-libreta-6845j",2019-06-17 17:38:12
"VENDEDOR POR REDES SOCIALES","Importante empresa","Ejecutivo Comercial","Ventas - Comercial","Hace 1 mes ","Venta y Distribución por Redes Sociales. Trabajo part time o full time. Buena presencia y puntualidad. Entre 18 a 40 no excluyente. Actitud y ganas de  tra ...","montevideo","/anuncio/vendedor-por-redes-sociales-m3muu",2019-06-17 17:38:12
"VENDEDOR Y DISTRIBUIDOR","SALUD","Ejecutivo Comercial","Ventas - Comercial","Hace 1 mes ","Buscamos jóvenes entre 18 y 35 años, con actitud emprendedora, energía positiva y pro activos.  Valoramos la responsabilidad, la puntualidad y la capacidad ...","montevideo","/anuncio/vendedor-y-distribuidor-46smq",2019-06-17 17:38:12
"CADETE PARA EMPRESA DE COMIDA SALUDABLE","Empresa Comida Saludable","Auxiliar","Cadetería - Cobranzas","Hace 1 mes ","Buscamos alguien ágil, simpático, puntual para la entrega de comida saludable a domicilio, para 3 días a la semana: Lunes, Miercoles y Viernes, por la maña ...","montevideo","/anuncio/cadete-para-empresa-de-comida-saludable-5tg87",2019-06-17 17:38:12
"VENDEDOR","SIN LÍMITES","Ejecutivo Comercial","Ventas - Comercial","Hace 1 mes ","Buscamos jóvenes emprendedores, con gusto por las ventas, buena actitud, buena presencia, comprometidos y responsables. El trabajo se gestiona a través de  ...","montevideo","/anuncio/vendedor-ayymv",2019-06-17 17:38:12
"AUXILIAR ADMINISTRATIVO","Empresa del rubro ferretería","Asistente","Finanzas - Contabilidad - Auditoria","Hace 1 mes ","-Ingresar registro contables -Tareas administrativas  -Pago a proveedores -Conciliación de cuentas (bancos, proveedores, deudores, tarjetas) -Uso de Memory ...","montevideo","/anuncio/auxiliar-administrativo-qzups",2019-06-17 17:38:12
"VENTAS-DISPONIBILIDAD HORARIA","Importante empresa","Ejecutivo Comercial","Ventas - Comercial","Hace 1 mes ","Se solicitan jóvenes de 20 a 30 años, responsables, puntuales, con buen manejo de redes sociales e internet. Ganancias diarias, quincenales, bonos  de dine ...","montevideo","/anuncio/ventas-disponibilidad-horaria-mq8jd",2019-06-17 17:38:12
"MOZAS Y/O MOZOS","Importante empresa","Auxiliar","Hotelería - Gastronomía - Turismo","Hace 1 mes ","Atención al publico. Puesta a punto del local Armado de exhibición de productos - Buena actitud de servicio. - Trabajo en equipo - Se valora experiencia pr ...","montevideo","/anuncio/mozas-y-o-mozos-3b4rv",2019-06-17 17:38:12
"RESPONSABLE COMERCIAL Y FINANCIERO PROYECTO PLATAFORMA INDUSTRIAL","SChConsultores Soluciones en Capital Humano","Supervisor / Encargado","Ventas - Comercial","Hace 1 mes ","Leer condiciones REQUISITOS EXCLUYENTES: •	Profesional universitario de las áreas de Administración de Empresas, Marketing, Contador u otras carreras vin ...","montevideo","/anuncio/responsable-comercial-y-financiero-proyecto-plataforma-industrial-a5nme",2019-06-17 17:38:12
"TECHNICAL DIRECTOR","QDOT | Digital-Out-of-Home","Gerente","Directivos - Ejecutivos","Hace 1 mes ","The Challenge Two years ago we established a product development team in Montevideo and are looking for a Technical Director to support their growth, help ...","montevideo","/anuncio/technical-director-ue5ep",2019-06-17 17:38:12
"VENDEDOR DISTRIBUIDOR INDEPENDIENTE","Importante empresa","Ejecutivo Comercial","Ventas - Comercial","Hace 1 mes ","La búsqueda esta orientada a personas ambos sexos mayores de 30 años  y de NACIONALIDAD URUGUAYA (EXCLUYENTE) que quieran progresar a corto o mediano plazo ...","montevideo","/anuncio/vendedor-distribuidor-independiente-ts8az",2019-06-17 17:38:12
"LICENCIADO EN ENFERMERÍA","Importante empresa","Técnico / Especialista","Salud","Hace 1 mes ","Funciones y responsabilidades Licenciado en Enfermería, para docencia en importante escuela del sector. Imprescindible tener mínimo un año como Licenciado  ...","montevideo","/anuncio/licenciado-en-enfermeria-9r6m5",2019-06-17 17:38:12
"AUXILIAR ADMINISTRATIVO (ÁREA DE FINANZAS)","PwC Uruguay","Profesional","Finanzas - Contabilidad - Auditoria","Hace 1 mes ","•	Estudiante avanzado de Ciencias Económicas.  •	Experiencia mínima de dos años en cargos de similar responsabilidad y en el área de finanzas.  •	Manejo av ...","montevideo","/anuncio/auxiliar-administrativo-area-de-finanzas-53dpm",2019-06-17 17:38:12
"ADMINISTRATIVO CONTABLE- EMPRESA CONSTRUCTORA","Incipio SRL","Asistente","Finanzas - Contabilidad - Auditoria","Hace 1 mes ","Principales funciones: -Pasaje de documentación al sistema contable -Conciliación bancos, deudores, acreedores -Altas/Bajas GAFI, control de legajos del pe ...","montevideo","/anuncio/administrativo-contable-empresa-constructora-je94b",2019-06-17 17:38:12
"MEJORA","Mejora tu vida","Ejecutivo Comercial","Ventas - Comercial","Hace 1 mes ","Jóvenes emprendedores de 18 a 33 años con deseo de superación, manejo de redes sociales, pro activos, brindamos capacitaciones constantes, ganancias diaria ...","montevideo","/anuncio/mejora-parhe",2019-06-17 17:38:12
"ASISTENTE EN COMUNICACION Y MARKETING DIGITAL","Importante empresa","Profesional","Arte - Diseño - Comunicación","Hace 1 mes ","Nos encontramos en la búsqueda de una persona proactiva,eficiente con capacidad organizativa y multitasking, contar con una amplia visión de inovacion y bú ...","montevideo","/anuncio/asistente-en-comunicacion-y-marketing-digital-mj8ma",2019-06-17 17:38:12
"VENDEDORAS CAJERAS ENCARGADAS SHOPPING",NA,"Ejecutivo Comercial","Ventas - Comercial","Hace 1 mes ","Orientamos la búsqueda a personas: -	mayores de 25 años -	proactivas, responsables y amables -	con gusto por la atención al cliente y el trabajo en equipo ...","montevideo","/anuncio/vendedoras-cajeras-encargadas-shopping-b8t5p",2019-06-17 17:38:12
"ARQUITECTO/INGENIERO","A&C Constructora","Profesional","Construcción - Arquitectura","Hace 4 semanas ","Jefe de Obras Gerenciamiento de Obras de Construcción , experiencia minima 3 años comprobables, full time , pro-activo .","montevideo","/anuncio/arquitecto-ingeniero-8m4yv",2019-06-17 17:38:12
"PRESUPUESTADOR PARA A&C CONSTRUCTORA",NA,"Profesional","Construcción - Arquitectura","Hace 4 semanas ","Cotizar obras de Construcción en Licitaciones publicas y privadas. Metrajes, visitas a obra, relacionamiento con clientes. SELECCIONAMOS 1 PRESUPUESTADOR D ...","montevideo","/anuncio/presupuestador-para-a-c-constructora-27y38",2019-06-17 17:38:12
"AUXILIAR CONTABLE ADMINISTRATIVA","López Viñán & Asociados Consulting","Auxiliar","Finanzas - Contabilidad - Auditoria","Hace 1 mes ","Requisitos Experiencia (excluyente) en Estudios Contables o Consultoras en registraciones contables, atención al cliente, tareas administrativas y trámites ...","montevideo","/anuncio/auxiliar-contable-administrativa-72rau",2019-06-17 17:38:12
"VENDEDOR FREELANCE","Salud Vital","Ejecutivo Comercial","Ventas - Comercial","Hace 1 mes ","Importante empresa busca vendedores con o sin experiencia para trabajar desde las redes sociales. Nos enfocamos en jóvenes entre 18 y 40 años para la venta ...","montevideo","/anuncio/vendedor-freelance-usjha",2019-06-17 17:38:12
"CONTADOR","PKMConsultores","Profesional","Finanzas - Contabilidad - Auditoria","Hace 1 mes ","Contador Público con 3 años de experiencia para importante empresa de plaza, con muy buen manejo de herramientas Microsoft Office. Se valorará conocimiento ...","montevideo","/anuncio/contador-6z78a",2019-06-17 17:38:12
"ESTUDIANTE AVANZADO DE ARQUITECTURA O DISEÑO INDUSTRIAL","Importante empresa","Profesional","Construcción - Arquitectura","Hace 1 mes ","Presupuestación, proyecto y coordinación.  Medio horario con flexibilidad. Empresa de proyectos en madera.","montevideo","/anuncio/estudiante-avanzado-de-arquitectura-zmeru",2019-06-17 17:38:12
"EMPRESA MULTINACIONAL BUSCA VENDEDORES","Freelance Work Teams","Ejecutivo Comercial","Ventas - Comercial","Hace 1 mes ","Estamos buscando vendedores para incorporarse a reconocida empresa multinacional dedicada a la venta y distribución a nivel nacional e internacional brinda ...","montevideo","/anuncio/empresa-multinacional-busca-vendedores-hnz48",2019-06-17 17:38:12
"SE NECESITAN VENDEDORES PARA EMPRESA MULTINACIONAL","Freelance Work Teams","Ejecutivo Comercial","Ventas - Comercial","Hace 1 mes ","Estamos buscando vendedores para incorporarse a empresa multinacional dedicada a la venta y distribución a nivel nacional e internacional brindando asesora ...","montevideo","/anuncio/se-necesitan-vendedores-para-empresa-multinacional-vm4uz",2019-06-17 17:38:12
"ANALISTA SR. IT","Importante empresa","Analista","Tecnologías de la información","Hace 1 mes ","Habilidades: •	Habilidades de comunicación y relacionamiento con personas de diferentes áreas. •	Pro activo en la búsqueda de soluciones. •	Trabajo en equi ...","montevideo","/anuncio/analista-sr-it-25yya",2019-06-17 17:38:12
"ANALISTA FUNCIONAL SR CON 2 AÑOS DE EXPERIENCIA O MÁS","Sinfor SRL","Analista","Tecnologías de la información","Hace 1 mes ","Ingeniera/o o Licenciatura de Sistemas Análisis de Procesos de Negocio Relevamiento de Procesos Administración y seguimiento de Proyectos Herramientas Offi ...","montevideo","/anuncio/analista-funcional-sr-con-2-anos-de-experiencia-o-mas-gahrj",2019-06-17 17:38:12
"OFERTA UNICA! - SE BUSCAN VENDEDORES","Importante empresa","Ejecutivo Comercial","Ventas - Comercial","Hace 1 mes ","Nos encontramos en busca de jóvenes con carácter emprendedor para el área de ventas, con vocación de servicio en atención y asesoramiento al cliente.  Hora ...","montevideo","/anuncio/oferta-unica-se-buscan-vendedores-9zv43",2019-06-17 17:38:12
"VENTAS - REDES SOCIALES","TeamSale","Ejecutivo Comercial","Ventas - Comercial","Hace 1 mes ","Ventas a través de redes sociales, cuidado de cartera de clientes, asesoramiento personalizado.  Manejo de herramientas informáticas Intermedio- Avanzado   ...","montevideo","/anuncio/ventas-redes-sociales-qpv24",2019-06-17 17:38:12
"SOLICITAMOS EJECUTIVOS DE VENTAS","Freelance Work Teams","Ejecutivo Comercial","Ventas - Comercial","Hace 1 mes ","Estamos buscando Ejecutivo de Ventas para incorporarse a empresa dedicada a la venta y distribución a nivel nacional e internacional brindando asesoramient ...","montevideo","/anuncio/solicitamos-ejecutivos-de-ventas-zbvym",2019-06-17 17:38:12
