"puesto","empresa","nivel","area","fecha","detalle","dpto","link","fecha_scraping"
"CHOFER PARA TAXI ELÉCTRICO",NA,"Peon","Servicios - Oficios","Hace 1 mes ","SE BUSCAN CHOFERES PARA TAXI ELÉCTRICO, CON FLEXIBILIDAD HORARIA (trato directo con dueño) BUSCAMOS CANDIDATOS CON:  - LIBRETA PROFESIONAL. CAT E - BUENA ...","montevideo","/anuncio/chofer-para-taxi-electrico-e3q7u",2019-05-05 19:55:55
"VENDEDOR DISTRIBUIDOR INDEPENDIENTE","Importante empresa","Ejecutivo Comercial","Ventas - Comercial","Hace 1 mes ","Empresa Internacional busca Vendedores y/o Distribuidores para trabajar de forma INDEPENDIENTE, mayores de 25 años. Desempeño total o parcial, con conocimi ...","montevideo","/anuncio/vendedor-distribuidor-independiente-8tjpq",2019-05-05 19:55:55
"ENCARGADO DE SEGURIDAD BARRIOS PRIVADOS","Importante empresa","Jefe","Seguridad - Vigilancia","Hace 1 mes ",". Buscamos incorporar al equipo un ENCARGADO de Seguridad que cumpla con las siguientes funciones en Barrios Privados de Cuidad de la Costa:  Gestionar y  ...","montevideo","/anuncio/encargado-de-seguridad-barrios-privados-jvmhb",2019-05-05 19:55:55
"TALLERISTA DE DEPORTE","Centro Juvenil","Técnico / Especialista","Educación - Recreación - Deportes","Hace 1 mes ","Buscamos educador con experiencia en talleres de deporte con adolescentes para Centro Juvenil.  Martes y viernes en el horario de la tarde.  Es requisito e ...","montevideo","/anuncio/tallerista-de-deporte-yg392",2019-05-05 19:55:55
"AUXILIAR ADMINISTRATIVO","Teleshopping","Auxiliar","Administración - Secretariado","Hace 1 mes ","hacer tramites  atender la recepcion  tareas administrativas en general realizar las tareas que se le solicitan en tiempo y forma","montevideo","/anuncio/auxiliar-administrativo-2e6pu",2019-05-05 19:55:55
"VENDEDOR DE CALLE","Importante empresa","Ejecutivo Comercial","Ventas - Comercial","Hace 1 mes ","Buscamos jóvenes carismáticos para venta en la calle de productos de telefonía móvil. Se requiere buena presencia, buena disposición para el trabajo y flex ...","montevideo","/anuncio/vendedor-de-calle-dnyha",2019-05-05 19:55:55
"INSTRUCTOR Y VENTAS","Importante empresa","Profesional","Educación - Recreación - Deportes","Hace 1 mes ","Se lo formara como INSTRUCTOR, Ventas, atención al público, teléfono. Se valorara experiencia como docente en cualquier área, ventas, marketing. Coordialid ...","montevideo","/anuncio/instructor-y-ventas-qdbur",2019-05-05 19:55:55
"CAJERO/A ADMINISTRATIVO","Importante empresa","Auxiliar","Administración - Secretariado","Hace 1 mes ","Tareas inherentes a cajero y tareas administrativas tales como ingresar facturas al sistema Memory. Con conocimientos contables, preferentemente Memory y q ...","montevideo","/anuncio/cajero-a-administrativo-uydt8",2019-05-05 19:55:55
"GUARDIA DE SEGURIDAD PARA   MONTEVIDEO - LAGOMAR - ATLANTIDA","Servicios Complejos de Seguridad","Auxiliar","Seguridad - Vigilancia","Hace 1 mes ","Vigilancia, con horarios rotativos - Excluyente disponibilidad horaria Puntualidad Presencia Persona dinámica Compromiso Es necesario contar con CARNET DE ...","montevideo","/anuncio/guardia-de-seguridad-para-montevideano-lagomar-atlantida-ppm4s",2019-05-05 19:55:55
"MECÁNICO","  ","Técnico / Especialista","Producción","Hace 1 mes ","Requisitos: -Formación técnica en Mecánica-Electricidad automotriz, electro hidráulico. (Don Bosco, FPS, CETP-UTU). (no excluyente).  -Experiencia mayor a  ...","montevideo","/anuncio/mecanico-edpv4",2019-05-05 19:55:55
"VENDEDORA","Salud bienestar y calidad de vida ","Ejecutivo Comercial","Ventas - Comercial","Hace 1 mes ","Se necesitan vendedoras de 18 a 33 años con o sin experiencia en ventas. Horario Full-Time o Part-Time. Requisitos. puntual responsable buena presencia  pr ...","montevideo","/anuncio/vendedora-r3eh6",2019-05-05 19:55:55
"CAPATAZ DE OBRA PARA COOPERATIVA DE AYUDA MUTUA","cooperativa coviunsol","Supervisor / Encargado","Construcción - Arquitectura","Hace 1 mes ","RESPONSABILIDAD PARA CUMPLIR  AVANCES DE OBRA, AMPLIA EXPERIENCIA EN COOPERATIVAS DE AYUDA MUTUA REQUISITOS : EXPERIENCIA COMPROBADA  EN COOPERATIVAS DE AY ...","montevideo","/anuncio/capataz-de-obra-para-cooperativa-de-ayuda-mutua-srmdn",2019-05-05 19:55:55
"TECNICO PREVENCIONISTA PARA COOPERATIVA DE AYUDA MUTUA","cooperativa coviunsol","Técnico / Especialista","Recursos Humanos","Hace 1 mes ","TECNICO PREVENCIONISTA TITULADO REQUISITOS: EXPERIENCIA COMPROBADA EN COOPERATIVAS DE AYUDA MUTUA","montevideo","/anuncio/tecnico-prevencionista-para-cooperativa-de-ayuda-mutua-uzatg",2019-05-05 19:55:55
"GESTOR PARA COOPERATIVA DE AYUDA MUTUA","cooperativa coviunsol","Asistente","Administración - Secretariado","Hace 1 mes ","GESTOR PARA LIQUIDACION DE SUELDOS DE LA CONSTRUCCION Y TRAMITES EN ORGANISMOS PUBLICOS REQUISITOS. EXPERIENCIA COMPROBADA CON COOPERATIVAS DE AYUDA MUTUA","montevideo","/anuncio/gestor-para-cooperativa-de-ayuda-mutua-ssq75",2019-05-05 19:55:55
"NECESITAMOS VENDEDORES CON O SIN EXPERIENCIA","Freelance Work Teams","Ejecutivo Comercial","Ventas - Comercial","Hace 1 mes ","Venta y distribución Asesoramiento a clientes de forma presencial y vía web Seguimiento a los clientes REQUERIMIENTOS: Persona proactiva Buena presencia co ...","montevideo","/anuncio/necesitamos-vendedores-con-o-sin-experiencia-mmmht",2019-05-05 19:55:55
"GUARDIA DE SEGURIDAD (MONTEVIDEO, ROTATIVO)","Importante empresa de Seguridad","Auxiliar","Seguridad - Vigilancia","Hace 1 mes ","Se valora locomoción propia y experiencia comprobable Buscamos guardias para la zona de Montevideano como RETEN, con turnos rotativos y lugares rotativos  ...","montevideo","/anuncio/guardia-de-seguridad-montevideo-rotativo-uj6mn",2019-05-05 19:55:55
"GUARDIA DE SEGURIDAD (BARRIOS PRIVADOS CIUDAD DE LA COSTA)","Importante empresa","Auxiliar","Seguridad - Vigilancia","Hace 1 mes ","Se valora vivir en la zona Buscamos Guardias de Seguridad en la zona de Cuidad de la Costa y cercanías para ingresar en el equipo de BARRIOS PRIVADOS   Req ...","montevideo","/anuncio/guardia-con-locomocion-cuidad-de-la-costa-6rbpg",2019-05-05 19:55:55
"DESARROLLADOR FULL-STACK","ORMEN","Analista","Tecnologías de la información","Hace 1 mes ","Descripción de las tareas: Participar en el diseño, implementación, despliegue y mantenimiento de una solución de software de alto porte. La solución a con ...","montevideo","/anuncio/desarrollador-full-stack-bujrh",2019-05-05 19:55:55
"DELIVERY PARA CARRASCO, PASO CARRASCO","CADETERIA","Auxiliar","Cadetería - Cobranzas","Hace 1 mes ","Es IMPRESCINDIBLE que conozca la zona y tener experiencia en el rubro. Trabajo fijo y TODO en regla. Moto en condiciones y documentación al día. Necesita D ...","montevideo","/anuncio/delivery-para-carrasco-paso-carrasco-zmee9",2019-05-05 19:55:55
"ENCARGADO DE COCINA Y EMPAQUE","Empresa Comida Saludable","Supervisor / Encargado","Hotelería - Gastronomía - Turismo","Hace 1 mes ","Armado y empaque de pedidos. Supervisar cocina y personal -Responsable, puntual -Organizada, Ágil -Toma de decisiones -Disponibilidad de horario matutino d ...","montevideo","/anuncio/encargado-de-cocina-y-empaque-h48sz",2019-05-05 19:55:55
"VENTAS FREE LANCE","Distribuidor Independiente JD","Ejecutivo Comercial","Ventas - Comercial","Hace 1 mes ","Ventas directas de nuestros y servicios al mercado nacional e internacional. Jóvenes entre 19 a 33 años Citaciones constantes. Ganancias diarias, quincenal ...","montevideo","/anuncio/ventas-free-lance-y9av7",2019-05-05 19:55:55
"VENTAS POR REDES SOCIALES","Importante empresa","Ejecutivo Comercial","Ventas - Comercial","Hace 1 mes ","Comercialización de productos, por medio de captación de clientes. Comercialización por medios digitales. Se valorara experiencia previa en ventas. Se debe ...","montevideo","/anuncio/ventas-por-redes-sociales-tajzb",2019-05-05 19:55:55
"JEFE DE INGENIERÍA Y MANTENIMIENTO","PwC Uruguay","Profesional","Producción","Hace 1 mes ","•	Profesional egresado de las carreras de ingeniería mecánica o química con posgrado de IG3 (no excluyente). •	Será excluyente contar como mínimo con tres  ...","montevideo","/anuncio/jefe-de-ingenieria-y-mantenimiento-aysa3",2019-05-05 19:55:55
"CAJERO MATUTINO MINIMERCADO CARRASCO","Importante empresa","Auxiliar","Ventas - Comercial","Hace 1 mes ","Nos orientamos a la búsqueda de personas responsables, confiables, proactivas y con marcado perfil orientado al cliente. Para caja de Minimercado de Estaci ...","montevideo","/anuncio/cajero-matutino-minimercado-carrasco-m2sbd",2019-05-05 19:55:55
"ENCARGADO/A DE COMPRAS","PwC Uruguay","Supervisor / Encargado","Administración - Secretariado","Hace 1 mes ","•	Profesional o estudiante avanzado/a de las carreras de ingeniería, administración de empresas y/o tecnicaturas. •	Experiencia mínima de 5 años en cargo s ...","montevideo","/anuncio/encargado-a-de-compras-v8vg3",2019-05-05 19:55:55
"ADMINISTRATIVA - COMERCIO EXTERIOR","Importante empresa","Auxiliar","Administración - Secretariado","Hace 1 mes ","Se busca administrativa con experiencia en comercio exterior. Imprescindible contar con un buen dominio de herramientas informáticas. Jornada laboral : Lun ...","montevideo","/anuncio/administrativa-comercio-exterior-7asm3",2019-05-05 19:55:55
"RECEPCIONISTA PARA PELUQUERÍA","Importante empresa","Auxiliar","Atención al cliente","Hace 1 mes ","Peluquería solicita recepcionista para las siguientes funciones: Recepción de clientes Recepción telefónica Responder redes sociales Cobrar Mantener al día ...","montevideo","/anuncio/recepcionista-para-peluqueria-s4s8s",2019-05-05 19:55:55
"VENDEDOR/A","Salud bienestar y dinero ","Ejecutivo Comercial","Ventas - Comercial","Hace 1 mes ","Jóvenes emprendedores de 18 a 33 años con deseo de superación, manejo de redes sociales, pro activos, brindamos capacitaciones constantes, ganancias diaria ...","montevideo","/anuncio/vendedor-a-qvntg",2019-05-05 19:55:55
"AUXILIAR DE LIMPIEZA","Importante empresa","Auxiliar","Servicios - Oficios","Hace 1 mes ","Buscamos una persona dinámica, con vocación de servicio, discreta, con buena disposición y buena presencia, para encargarse de la limpieza general de nuest ...","montevideo","/anuncio/auxiliar-de-limpieza-44sj6",2019-05-05 19:55:55
"AUXILIAR PARA FABRICA DE LIBROS","Importante encuadernadora","Auxiliar","Producción","Hace 1 mes ","Buscamos Auxiliar de sexo femenino preferentemente entre 30 y 45 años para tareas de encuadernación. No es necesario conocimientos previos, si es important ...","montevideo","/anuncio/auxiliar-para-fabrica-de-libros-7yqyt",2019-05-05 19:55:55
"VENDEDOR","AvMsa","Ejecutivo Comercial","Ventas - Comercial","Hace 1 mes ","Nos encontramos en busca de jóvenes con carácter emprendedor para el área de ventas, con vocación de servicio en atención y asesoramiento al cliente Horar ...","montevideo","/anuncio/vendedor-b98te",2019-05-05 19:55:55
"SE SOLICITAN VENDEDORES CON O SIN EXPERIENCIA","TeamSale","Ejecutivo Comercial","Ventas - Comercial","Hace 1 mes ","ventas a realizar mediante plataformas web, vía telefónica  y personal. seguimiento post venta, fidelización de cartera de clientes asesoramiento personali ...","montevideo","/anuncio/se-solicitan-vendedores-con-o-sin-experiencia-46qyq",2019-05-05 19:55:55
"AT. AL CLIENTE, VENTAS, ADMINISTRACIÓN, MANTENIMIENTO, DEPOSITO, LIMPIEZA, PORTERÍA.","Importante empresa","Auxiliar","Atención al cliente","Hace 1 mes ","Ventas, atención al cliente, administración, atención telefónica, mantenimiento, depósito, limpieza y portería. Ventas, atención al cliente, administración ...","montevideo","/anuncio/at-al-cliente-ventas-administracion-mantenimiento-deposito-limpieza-porteria-r3vv8",2019-05-05 19:55:55
"PEON PARA DEPOSITO","Importante empresa","Auxiliar","Logística - Distribución","Hace 1 mes ","Mayorista Multirubro selecciona personal para el sector logistico. Se valora experiencia en manejo de articulos de almacen y experiencia en logistica. Las ...","montevideo","/anuncio/peon-para-deposito-7d5jv",2019-05-05 19:55:55
"VENTAS","Importante empresa","Ejecutivo Comercial","Ventas - Comercial","Hace 1 mes ","Buscamos personas entre 20 y 35 años Proactivas y responsables para venta, distribución y formación de equipos. El trabajo es mediante redes sociales, con  ...","montevideo","/anuncio/ventas-zvthu",2019-05-05 19:55:55
"BARISTA CON EXPERIENCIA.","Café en Punta Carretas","Auxiliar","Hotelería - Gastronomía - Turismo","Hace 1 mes ","Las principales funciones son:   - Preparacion de café en sus distintas modalidades. - Atencion al cliente de forma personalizada. - Despacho de mercaderia ...","montevideo","/anuncio/barista-con-experiencia-d3mg7",2019-05-05 19:55:55
"ASISTENTE PERSONAL","Particular","Auxiliar","Salud","Hace 1 mes ","Asistir a adulto mayor con Alzheimer en domicilio en el horario de 16 a 22 horas. Cumplir con los horarios y días de trabajo propuestos. Acompañar al pacie ...","montevideo","/anuncio/asistente-personal-5jrr8",2019-05-05 19:55:55
"CAJERA ADMINISTRATIVA PARA SHOPPING",NA,"Auxiliar","Ventas - Comercial","Hace 1 mes ","Nos encontramos en la búsqueda de cajeras administrativas para tiendas de indumentaria y calzado en shopping. Es requisito ser mayor de 25 años y tener ex ...","montevideo","/anuncio/cajera-administrativa-para-shopping-epnvh",2019-05-05 19:55:55
"DISEÑADOR GRAFICO/COMMUNITY MANAGER","Grupo Mup","Analista","Arte - Diseño - Comunicación","Hace 1 mes ","Importante cadena de locales gastronómicos selecciona estudiante o egresado de Diseño gráfico para integrarse al área de marketing. Nos orientamos a una pe ...","montevideo","/anuncio/disenador-grafico-community-manager-ptptu",2019-05-05 19:55:55
"PINTOR Y LUSTRADOR  PARA MADERA",NA,"Oficial","Servicios - Oficios","Hace 1 mes ","- Lustrador para la industria de muebles con experiencia en laca PU colora e incolora. - Conocimiento en procesos de lacas catalizadas, nitro, poliuretano  ...","montevideo","/anuncio/pintor-y-lustrador-para-madera-sr6yu",2019-05-05 19:55:55
"VENDEDORES","Importante empresa","Ejecutivo Comercial","Ventas - Comercial","Hace 1 mes ","Jóvenes emprendedores de 18 a 33 años con deseo de superación, manejo de redes sociales, pro activos, brindamos capacitaciones constantes, ganancias diaria ...","montevideo","/anuncio/vendedores-v7uze",2019-05-05 19:55:55
"DEPILADORA SISTEMA ESPAÑOL","empresa selecciona","Técnico / Especialista","Servicios - Oficios","Hace 1 mes ","Buscamos especialistas en depilación método sistema español únicamente con experiencia  , detallistas , con buena presencia y disponibilidad para trabajar  ...","montevideo","/anuncio/depiladora-sistema-espanol-hyz8j",2019-05-05 19:55:55
"VENDEDORES - ATENCION AL CLIENTE","Importante empresa","Ejecutivo Comercial","Ventas - Comercial","Hace 1 mes ","Nos encontramos en busca de jóvenes con carácter emprendedor para el área de ventas, con vocación de servicio en atención y asesoramiento al cliente.  Hora ...","montevideo","/anuncio/vendedores-atencion-al-cliente-z7jh3",2019-05-05 19:55:55
"VENDEDOR PARA DISTRIBUIDOR MAYORISTA","Importante empresa","Ejecutivo Comercial","Ventas - Comercial","Hace 1 mes ","Distribuidor Mayorista Multirubro selecciona vendedor/a para su sector comercial. La busqueda esta orientada a persona con marcado perfil comercial, orien ...","montevideo","/anuncio/vendedor-para-distribuidor-mayorista-6vpdz",2019-05-05 19:55:55
"COCINERO",NA,"Técnico / Especialista","Hotelería - Gastronomía - Turismo","Hace 1 mes ","Cocina y reposteria Mise en place, producción, despacho, mantenimiento de área de trabajo limpias, seguir procedimientos estandarizados","montevideo","/anuncio/cocinero-ye2pg",2019-05-05 19:55:55
"TELEFONISTA ADMINISTRATIVA PARA PERSONAS CON DISCAPACIDAD MOTRIZ","Importante empresa en el rubro Automotriz","Auxiliar","Administración - Secretariado","Hace 1 mes ","Buscamos persona con: Manejo de central telefónica, buen trato con el público,  experiencia previa en la función, conocimientos de informática y excelente  ...","montevideo","/anuncio/telefonista-administrativa-zpdm2",2019-05-05 19:55:55
"NIÑERA (CUIDADORA DE NIÑO)","Importante empresa","Auxiliar","Servicios - Oficios","Hace 1 mes ","Dirigimos nuestra búsqueda a personas con actitud de servicio y experiencia en el cuidado de niños. Requisitos: - Edad: Desde 21 hasta 50 años. - Sexo: Fem ...","montevideo","/anuncio/ninera-cuidadora-de-nino-6qb73",2019-05-05 19:55:55
"LICENCIADO EN ENFERMERIA",NA,"Técnico / Especialista","Salud","Hace 1 mes ","Licenciado en Enfermería, para docencia en importante escuela del sector. Imprescindible tener mínimo un año como Licenciado y titulo certificado por M.S.P ...","montevideo","/anuncio/licenciado-en-enfermeria-7r6gb",2019-05-05 19:55:55
"LICENCIADO EN ENFERMERÍA","Importante empresa","Técnico / Especialista","Salud","Hace 1 mes ","Licenciad en Enfermería, para docencia en importante escuela del sector. Imprescindible tener mínimo un año como Licenciado y titulo certificado por M.S.P. ...","montevideo","/anuncio/licenciado-en-enfermeria-n2d3r",2019-05-05 19:55:55
"AUXILIAR DE DEPOSITO","Importante empresa","Auxiliar","Logística - Distribución","Hace 1 mes ","Ingreso de datos digitales  Preparar pedidos  Hacer stock Deposito","montevideo","/anuncio/auxiliar-de-depocito-hzt4d",2019-05-05 19:55:55
"VENTAS DIRECTAS","Equipo RyK","Ejecutivo Comercial","Ventas - Comercial","Hace 1 mes ","ventas directas de nuestros productos y servicios al mercado nacional e internacional. capacitaciones  constante  Ganancias Diarias  quincenales  Bonos  Vi ...","montevideo","/anuncio/ventas-directas-p4r9g",2019-05-05 19:55:55
"TÉCNICO O ESTUDIANTE AVANZADO REFRIGERACIÓN INDUSTRIAL, PART TIME","Biosistemas ","Técnico / Especialista","Producción","Hace 1 mes ","Reparación y Mantenimiento de equipos y sistemas refrigeración (No aire acondicionado).  Visita a clientes, atención telefónica, libreta de conducir. Se va ...","montevideo","/anuncio/tecnico-o-estudiante-avanzado-refrigeracion-industrial-part-time-4v2et",2019-05-05 19:55:55
"AUXILIAR DE VENTAS","Biosistemas","Auxiliar","Ventas - Comercial","Hace 1 mes ","Ventas, tareas de seguimiento y promoción de equipos e insumos para medicina laboratorios, universidades, industrias y sanatorios. Preparación de material  ...","montevideo","/anuncio/auxiliar-de-ventas-nnhtb",2019-05-05 19:55:55
"SOPORTE E IMPLEMENTACIÓN DE SOFTWARE","Zureo Software","Asistente","Tecnologías de la información","Hace 1 mes ","- Nos encontramos en la búsqueda de jóvenes con formación en Contabilidad y Administración, para realizar implementaciones y atender dudas de clientes en r ...","montevideo","/anuncio/soporte-e-implementacion-de-software-rvg37",2019-05-05 19:55:55
"ADMINISTRATIVA","Nueva Era Pet Care and Food","Asistente","Finanzas - Contabilidad - Auditoria","Hace 1 mes ","Administracion, control cajas y facturacion Administrativas","montevideo","/anuncio/administrativa-ez2hq",2019-05-05 19:55:55
"CAJERAS Y MOZAS SIN EXPERIENCIA","Grupo Mup","Auxiliar","Ventas - Comercial","Hace 1 mes ","Importante restaurante en Pocitos selecciona chicas de 18 a 24 años, indispensable buena presencia, dinámicas y responsables para el turno nocturno. Dispon ...","montevideo","/anuncio/cajeras-y-mozas-sin-experiencia-9eb8t",2019-05-05 19:55:55
"EMPRENDEDOR/RA","Importante empresa","Ejecutivo Comercial","Ventas - Comercial","Hace 1 mes ","Oportunidad de negocio independiente, para emprendedores/as que deseen aumentar sus ingresos, productos de calidad, sin límites de edad y sexo.  Actitud pa ...","montevideo","/anuncio/emprendedor-ra-gyydr",2019-05-05 19:55:55
"ADMINISTRACIÓN Y LOGÍSTICA PART TIME - EXCLUYENTE EXPERIENCIA MANEJO STOCK","Rewo Uruguay ","Auxiliar","Administración - Secretariado","Hace 1 mes ","Se trata de una propuesta Part time de 4 hrs con posibilidad de extenderse a 8 hrs. Se busca personal de sexo femenino con formación administrativa, logíst ...","montevideo","/anuncio/administracion-y-logistica-part-time-rpsgb",2019-05-05 19:55:55
"AYUDANTE DE COCINA/BACHERO","Importante empresa","Auxiliar","Hotelería - Gastronomía - Turismo","Hace 1 mes ","Realizar preparaciones sin gluten, mise en place, tortillas de maíz, Tartas, minutas, postres y bachero. puntualidad, honestidad, atención en el trabajo, r ...","montevideo","/anuncio/ayudante-de-cocina-bachero-6phr2",2019-05-05 19:55:55
"NUEVO VENDEDOR","Herbalife","Ejecutivo Comercial","Ventas - Comercial","Hace 1 mes ","Venta y reclutamiento Ser emprendedor y tener ganas de crecer","montevideo","/anuncio/nuevo-vendedor-58je5",2019-05-05 19:55:55
"AUXILIAR DE CUENTAS CORRIENTES","Perfiles360","Auxiliar","Administración - Secretariado","Hace 1 mes ","Seguimiento y control de cuentas corrientes, contacto con clientes y equipo de vendedores. Generar reportes de las cuentas asignadas.","montevideo","/anuncio/auxiliar-de-cuentas-corrientes-8ju5p",2019-05-05 19:55:55
"ESTUDIANTE CCEE P/SOPORTE SOFTWARE GESTION PYMES","AyP Ingeniería en Software","Auxiliar","Atención al cliente","Hace 1 mes ","Buscamos persona con gran orientación hacia la satisfacción del cliente y capacidad resolutiva para dar soporte a nuestros clientes y mantenimiento de la d ...","montevideo","/anuncio/estudiante-ccee-p-soporte-software-gestion-pymes-bvn9t",2019-05-05 19:55:55
"TAROTISTA","Importante Call Center","Técnico / Especialista","Servicios - Oficios","Hace 1 mes ","La búsqueda se orienta hacia profesionales en el arte del tarot. Excelente dicción, dinámica ,responsable que guste de los desafíos por alcanzar metas.   S ...","montevideo","/anuncio/operadora-calificada-qgdae",2019-05-05 19:55:55
"ESTUDIANTE DE CONTADOR PÚBLICO CON EXPERIENCIA EN AUDITORIA","AUREN","Asistente","Finanzas - Contabilidad - Auditoria","Hace 1 mes ","AUREN capital Humano selecciona para incorporar a la firma Estudiantes de Contador Público con experiencia en Auditoria. Orientamos la búsqueda a estudian ...","montevideo","/anuncio/estudiantes-de-contador-publico-con-experiencia-en-auditoria-g2q83",2019-05-05 19:55:55
"ASESOR TÉCNICO","Perfiles360","Profesional","Construcción - Arquitectura","Hace 1 mes ","Desarrollar y potencias la marca de diferentes productos comerciales mediante el asesoramiento técnico de los mismos. Relacionamiento con actuales y potenc ...","montevideo","/anuncio/asesor-tecnico-2u9e8",2019-05-05 19:55:55
"DISEÑADOR GRÁFICO PARA ECOMMERCE","Importante empresa","Analista","Arte - Diseño - Comunicación","Hace 1 mes ","Somos una empresa dedicada al comercio electrónico en pleno desarrollo con grandes posibilidades de crecimiento. Nos encontramos en búsqueda de un diseñado ...","montevideo","/anuncio/disenador-grafico-para-ecommerce-639un",2019-05-05 19:55:55
"JEFE DE COCINA PARA IMPORTANTE RESTAURANTE EN POCITOS","MONTEVIDEO BEER COMPANY","Supervisor / Encargado","Hotelería - Gastronomía - Turismo","Hace 1 mes ","Se busca Jefe de Cocina de 25 a 35 años, para restaurante en la zona de pocitos/punta carretas para turno nocturno. Disponibilidad para trabajar fines de s ...","montevideo","/anuncio/jefe-de-cocina-para-importante-restaurante-en-pocitos-gmtqm",2019-05-05 19:55:55
"COCINEROS Y AYUDANTES DE COCINA","MONTEVIDEO BEER COMPANY","Auxiliar","Hotelería - Gastronomía - Turismo","Hace 1 mes ","Importante empresa selecciona cocinero y ayudantes de cocina, para el turno nocturno en restaurantes de pocitos y punta carretas.  Apuntamos a personas que ...","montevideo","/anuncio/cocineros-y-ayudantes-de-cocina-4ebsd",2019-05-05 19:55:55
"BACHERO",NA,"Auxiliar","Hotelería - Gastronomía - Turismo","Hace 1 mes ","limpieza y mantenimiento de vajilla, equipamientos de cocina, cuberteria, áreas publicas. mantener áreas de trabajo limpias y ordenadas, aplicar procedimie ...","montevideo","/anuncio/bachero-pg2v2",2019-05-05 19:55:55
"VENDEDOR/A","NGastambide S. A. ","Ejecutivo Comercial","Ventas - Comercial","Hace 1 mes ","Se buscan vendedoras de 18 a 33 años con o sin experiencia. Horario Part-Time o Full-Time REQUISITOS: Responsabilidad, capacidad de trabajo en equipo, buen ...","montevideo","/anuncio/vendedor-a-8z79g",2019-05-05 19:55:55
"INGENIERO ELÉCTRICO","Importante empresa","Profesional","Producción","Hace 1 mes ","Ingeniero eléctrico / industrial con experiencia en obras de planta externa de UTE para trabajar en un país de la región. Ingeniero eléctrico / industrial  ...","montevideo","/anuncio/ingeniero-electrico-ebn8y",2019-05-05 19:55:55
"PANADERO","empresa","Técnico / Especialista","Servicios - Oficios","Hace 1 mes ","Seleccionamos Panadero para trabajo en la mañana de lunes a sábados. No se trabaja en la noche.  Imprescindible buena disposición al trabajo en equipo y r ...","montevideo","/anuncio/panadero-gquan",2019-05-05 19:55:55
"VENDEDOR/A PARA REDES SOCIALES - PART TIME O FULL TIME","EME EMPRENDIMIENTO ","Ejecutivo Comercial","Ventas - Comercial","Hace 1 mes ","Somos una empresa de ventas directas donde formamos a profesionales de la venta. Ofrecemos capacitaciones constante  Ganancias Diarias  Quincenales  Bonos  ...","montevideo","/anuncio/vendedor-a-para-redes-sociales-part-time-o-full-time-d6sn2",2019-05-05 19:55:55
"VENDEDORA","Salud Belleza Progreso","Ejecutivo Comercial","Ventas - Comercial","Hace 1 mes ","Se necesitan Vendedoras entre 18 y 33 años. Con o sin experiencia en ventas. Horario full-time o part-time. Requisitos: <U+25B6>Puntual <U+25B6>Pro activa <U+25B6> Responsable ...","montevideo","/anuncio/vendedora-3naun",2019-05-05 19:55:55
