"puesto","empresa","nivel","area","fecha","detalle","dpto","link","fecha_scraping"
"COLORISTA CORTADORA EXPERIENTE PARA SALÓN KERASTASE",NA,"Técnico / Especialista","Servicios - Oficios","Hace 2 semanas "," BRUSHINISTA/COLORISTA/CORTADORA GRAN OPORTUNIDAD LABORAL Muy experiente para gran Salon Kerastase, sobre 18 de Julio Sueldo inicial apróx. $ 30/40mil a má ...","montevideo","/anuncio/colorista-cortadora-experiente-para-salon-kerastase-dm9t3",2019-06-17 17:38:12
"ATENCION PARA CARRO DE CHORIZOS",NA,"Auxiliar","Servicios - Oficios","Hace 2 semanas "," Muchacha dinamica, con conocimientos sobre el tema y experiencia.","montevideo","/anuncio/atencion-para-carro-de-chorizos-a87dz",2019-06-17 17:38:12
"PROFESORA",NA,"Profesional","Educación - Recreación - Deportes","Hace 2 semanas "," PROFESORA Inglés con expe riencia y certificación. Enviar  Curriculum","montevideo","/anuncio/profesora-degtp",2019-06-17 17:38:12
"VENDEDORES",NA,"Ejecutivo Comercial","Ventas - Comercial","Hace 2 semanas "," VENDEDORES aumente sus ingresos en aproximado $ 30.000. a nivel  nacional e internacional, requisitos  ser dinámico/a, creativo/a, tener v isión y desar ...","montevideo","/anuncio/vendedores-berv8",2019-06-17 17:38:12
"ADMINISTRACIÓN Y VENTAS",NA,"Supervisor / Encargado","Administración - Secretariado","Hace 2 semanas "," Ideal estudiante","montevideo","/anuncio/administracion-y-ventas-up2ag",2019-06-17 17:38:12
"VENDEDOR DE PRODUCTOS DE LIMPIEZA Y QUIMICOS",NA,"Ejecutivo Comercial","Ventas - Comercial","Hace 2 semanas "," VENDEDOR de productos de limpieza, y químicos con experiencia en ventas. Se valorará cartera de clientes y libreta de chofer. Enviar CV","montevideo","/anuncio/vendedor-de-productos-de-limpieza-y-quimicos-udraj",2019-06-17 17:38:12
"SECRETARIA",NA,"Asistente","Administración - Secretariado","Hace 2 semanas "," SECRETARIA  con conocimientos de  inglés y experiencia en venta. CV. c/foto","montevideo","/anuncio/secretaria-q2sub",2019-06-17 17:38:12
"APRENDIZ O APRENDIZ AVANZADO",NA,"Técnico / Especialista","Producción","Hace 2 semanas "," Para taller mecánico de motos, con libreta.","montevideo","/anuncio/aprendiz-o-aprendiz-avanzado-azsqe",2019-06-17 17:38:12
"AYUDANTE DE COCINA",NA,"Auxiliar","Hotelería - Gastronomía - Turismo","Hace 2 semanas "," Para cafeteria-comedor.  Experiencia excluyente y buena presencia.","montevideo","/anuncio/ayudante-de-cocina-7r8qt",2019-06-17 17:38:12
"ATENCIÓN AL PÚBLICO",NA,"Auxiliar","Atención al cliente","Hace 2 semanas "," Asistente de salon para cafeteria-comedor.  Experiencia excluyente y buena presencia.","montevideo","/anuncio/atencion-al-publico-6sshd",2019-06-17 17:38:12
"AUXILIAR DE FARMACIA","Importante empresa","Auxiliar","Atención al cliente","Hace 1 semana ","VENTA AL MOSTRADOR, RECEPCION DE MERCADERIA, STOCK DE MERCADERIA, VENCIMIENTOS. HORARIO CORTADO ATENDER CON ESMERO Y SER RESPONSABLE EN CUANTO A LA MERCADE ...","montevideo","/anuncio/auxiliar-de-farmacia-az2yr",2019-06-17 17:38:12
"DISEÑADOR DE INTERIORES COMERCIAL",NA,"Técnico / Especialista","Arte - Diseño - Comunicación","Hace 1 semana ","Se ofrece: -La posibilidad de integrarse a una sólida organización líder en su rubro en proceso de expansión sostenido y excelente ambiente laboral. -Capac ...","montevideo","/anuncio/disenador-de-interiores-comercial-u68te",2019-06-17 17:38:12
"ASESOR COMERCIAL","Importante empresa","Ejecutivo Comercial","Ventas - Comercial","Hace 1 semana ","Requisitos: -Entre 30 y 45 años. -Experiencia comprobada en ventas. -Estudios secundarios completos. -Se valoraran estudios de Marketing y Decoración de in ...","montevideo","/anuncio/asesor-comercial-ja67m",2019-06-17 17:38:12
"CADETE","Cadeteria Uruguay","Auxiliar","Cadetería - Cobranzas","Hace 2 semanas ","Reparto Con moto en regla, Reducto Pocitos y otras fijo y fin de semana.","montevideo","/anuncio/cadete-q8nza",2019-06-17 17:38:12
"ASISITENTE DE DEPARTAMENTO TECNICO EN INSTALACIONES ELETRICAS COMERCIALES E INDUSTRIALES","Alir ","Auxiliar","Administración - Secretariado","Hace 2 semanas ","Se requiere estudiante de ingenieria electrica o rubro similar, para trabajar como ayudante de Jefe de Departamente Tecnico en Empresa de Instalaciones Ele ...","montevideo","/anuncio/asisitente-de-departamento-tecnico-en-instalaciones-eletricas-comerciales-e-industriales-ejjge",2019-06-17 17:38:12
"AUXILIAR DE DEPOSITO","Importante empresa","Auxiliar","Logística - Distribución","Hace 2 semanas ","Importante empresa selecciona auxiliar de deposito. Para recepción y descarga de mercaderías. Armado de pedidos para el interior del país. Actitud pro acti ...","montevideo","/anuncio/auxiliar-de-deposito-9as39",2019-06-17 17:38:12
"AUXILIAR DE VENTAS MOSTRADOR","Importante empresa","Auxiliar","Ventas - Comercial","Hace 2 semanas ","Importante empresa selecciona vendedor de mostrador, ramo accesorios para marroquineria y demás. Se requiere buena presencia, trato amable con el publico,  ...","montevideo","/anuncio/auxiliar-de-ventas-mostrador-u825n",2019-06-17 17:38:12
"FIAMBRERA",NA,"Auxiliar","Hotelería - Gastronomía - Turismo","Hace 2 semanas "," Con experiencia Para granja  Con disponibilidad horaria","montevideo","/anuncio/fiambrera-syhaa",2019-06-17 17:38:12
"CHOFER VENDEDOR","Importante empresa","Peon","Servicios - Oficios","Hace 2 semanas ","Deberá desempeñar tareas de reparto y hacer nuevos clientes. Es una buena oportunidad para ingresar a una empresa consolidada en el mercado, se ofrece esta ...","montevideo","/anuncio/chofer-vendedor-d79mg",2019-06-17 17:38:12
"MOZA","RESTAURANTE EN L CENTRO","Auxiliar","Hotelería - Gastronomía - Turismo","Hace 2 semanas ","SE NECESITA MOZA DE SALON PARA RESTAURANTE EN EL CENTRO EN SAN JOSE 1229 ENTRE YI Y CUAREIM PRESENTARSE CON CURRICULUM DE 20 A 22 SE PIDE CON EXPERIENCIA   ...","montevideo","/anuncio/moza-r7nrb",2019-06-17 17:38:12
"DELIVERY",NA,"Auxiliar","Cadetería - Cobranzas","Hace 2 semanas "," DELIVERY con moto para  zonas Centro, Pocitos y Ciudad Vieja. Con dispo nibilidad horaria. Libreta de moto y experiencia excluyente","montevideo","/anuncio/delivery-32ppp",2019-06-17 17:38:12
"CUIDADORA",NA,"Peon","Servicios - Oficios","Hace 2 semanas "," CUIDADORAS para casa de salud,con disponibilidad de noche, sueldo $15.900 por mes.","montevideo","/anuncio/cuidadora-sed4s",2019-06-17 17:38:12
"TECNICO","ATE","Técnico / Especialista","Producción","Hace 2 semanas ","REPARACION DE ELECTRODOMESTICOS, REFRIGERADORES REPARAR REFRIGERADORES, CUMPLIR EL HORARIO DE TRABAJO, DISPONIBILIDAD HORARIA, BUEN TRATO CON LOS CLIENTES.","montevideo","/anuncio/tecnico-nv67t",2019-06-17 17:38:12
"CAJERO",NA,"Auxiliar","Ventas - Comercial","Hace 2 semanas "," CAJERAS para supermercado con experiencia.","montevideo","/anuncio/cajero-jd4m2",2019-06-17 17:38:12
"CHOFER",NA,"Peon","Servicios - Oficios","Hace 2 semanas "," CHOFER","montevideo","/anuncio/chofer-r3eus",2019-06-17 17:38:12
"OBSERVADORES EN CIRCUITOS","Cifra ","Auxiliar","Marketing - Publicidad","Hace 2 semanas ","CIFRA busca personas para trabajar en circuitos electorales en todo el país el día de las elecciones internas, domingo 30 de junio, de 19:00 a 23:00 horas. ...","montevideo","/anuncio/observadores-en-circuitos-m4du9",2019-06-17 17:38:12
"CHOFER",NA,"Peon","Servicios - Oficios","Hace 2 semanas "," CHOFER cat., D. Para barometrica, Enviar C.V., con referencias:","montevideo","/anuncio/chofer-q4tuv",2019-06-17 17:38:12
"AUXILIAR CONTABLE","MAZARS","Auxiliar","Finanzas - Contabilidad - Auditoria","Hace 2 semanas ","MAZARS es una firma internacional de origen francés, especializada en auditoría, contabilidad, impuestos y servicios de consultoría. Se encuentra presente  ...","montevideo","/anuncio/auxiliar-contable-vn89j",2019-06-17 17:38:12
"RECEPCIONISTA","ADVICE","Auxiliar","Administración - Secretariado","Hace 2 semanas ","Recepcionará y realizará llamadas telefónicas. Recibirá y enviará correspondencia. Gestionará cobranzas en forma telefónica. Llevará adelante tareas admini ...","montevideo","/anuncio/recepcionista-p6s58",2019-06-17 17:38:12
"OPERARIO PARA DEPOSITO","EMPRESA MAYORISTA EN INDUMENTARIA","Auxiliar","Logística - Distribución","Hace 2 semanas ","Preparación de pedidos.  Control de calidad.  Mantenimiento de inventario. Asegurar el correcto armado de pedidos a los clientes, llevar adelante los contr ...","montevideo","/anuncio/operario-para-deposito-8ragd",2019-06-17 17:38:12
"GERENTE","ADVICE","Gerente","Directivos - Ejecutivos","Hace 1 semana ","Supervisará el equipo de vendedores y otros cargos operativos.  Mantendrá contacto con empresas: alquiler corporativo.  Aumentará la cartera de clientes co ...","montevideo","/anuncio/gerente-mzjy2",2019-06-17 17:38:12
"CHOFER PARA TAXI",NA,"Peon","Servicios - Oficios","Hace 1 semana "," de 07:00 a 15:00 horas De lunes a sábados Zona Palacio Comision e incentivo","montevideo","/anuncio/chofer-para-taxi-jj525",2019-06-17 17:38:12
"MEDIO OFICIAL","Importante empresa","Técnico / Especialista","Construcción - Arquitectura","Hace 1 semana ","Se requiere personal con conocimientos de electricidad para trabajar durante un tiempo maximo de 3 meses en Empresa de Electricidad, con posibilidad a cont ...","montevideo","/anuncio/medio-oficial-vqjj3",2019-06-17 17:38:12
"VENDEDOR PARA IMPORTANTE EMPRESA LIDER EN EL RUBRO HERRAJES Y HERRERIA EN ACERO INOXIDABLE","LA CASA DEL HERRAJE","Ejecutivo Comercial","Ventas - Comercial","Hace 1 semana ","SE VALORA EL MANEJO DE REDES SOCIALES COMO FACEBOOK,INSTAGRAM, TWITTER,ETC. MANEJO DE PAGINA WEB. BASICO DE AUTOCAD Y MICROSOFT OFFICE.  LIBRETA DE CONDUCI ...","montevideo","/anuncio/vendedor-a-para-importante-empresa-lider-en-el-rubro-herrajes-y-herreria-en-acero-inoxidable-ghdsa",2019-06-17 17:38:12
"CAJERO TURNANTE CON EXPERIENCIA DE 2 AÑOS EN CAFETERÍAS O RESTAURANTES (EXCLUYENTE)","Importante empresa","Auxiliar","Atención al cliente","Hace 1 semana ","Nos encontramos en la búsqueda de 2 Cajeros/as ,con experiencia de dos años en el rubro gastronómico(excluyente). Deberá contar con disponibilidad para tra ...","montevideo","/anuncio/cajero-turnante-con-experiencia-de-2-anos-en-cafeterias-o-restaurantes-excluyente-up6g7",2019-06-17 17:38:12
"TALLERISTA",NA,"Oficial","Producción","Hace 1 semana "," para vestidos y palazos","montevideo","/anuncio/tallerista-pjsun",2019-06-17 17:38:12
"JORNALEROS PARA CONSTRUCCION - VARIAS PROFESIONES","Arquitecta","Oficial","Construcción - Arquitectura","Hace 1 semana ","Se necesitan jornaleros de todos los ámbitos para trabajos de construcción para varios trabajos esporádicos dentro de Montevideo. Necesitamos, entre otros, ...","montevideo","/anuncio/jornaleros-para-construccion-varias-profesiones-jnn5j",2019-06-17 17:38:12
"ADMINISTRATIVO -DISEÑO GRÁFICO-","Mutualista Hospital Evangélico","Analista","Arte - Diseño - Comunicación","Hace 1 semana ","Requisitos: *Bachillerato completo. *Diseñador Gráfico. *Sólidos conocimientos de programas de diseño web. *Manejo de herramientas informáticas (Windows Of ...","montevideo","/anuncio/administrativo-diseno-grafico-bp9tm",2019-06-17 17:38:12
"LIMPIADORA",NA,"Auxiliar","Servicios - Oficios","Hace 1 semana "," LIMPIADORA de 35 a 50 años, trabajo de 4 horas.","montevideo","/anuncio/limpiadora-45thp",2019-06-17 17:38:12
"VENDEDORA",NA,"Ejecutivo Comercial","Ventas - Comercial","Hace 1 semana "," VENDEDORA femenina mayores de 35 años para empresa internacion al, podrás independizarte económicamente con tiempo libre, rubro calidad de vida..","montevideo","/anuncio/vendedora-h3553",2019-06-17 17:38:12
"RECEPCIONISTA",NA,"Auxiliar","Administración - Secretariado","Hace 1 semana "," con experiencia en peluquería y/o centro  de estética, disponibilidad horaria y ganas de trabajar","montevideo","/anuncio/recepcionista-mvq8j",2019-06-17 17:38:12
"LAVADOR-CHOFER PARA ESTACIONAMIENTO","BT PERFORMANCE","Auxiliar","Servicios - Oficios","Hace 1 semana ","Se necesita persona masculina de 30 a 40 años para lavar vehículos y  labores en estacionamiento . Para el día. Funciones Lavadero: Lavador de autos:  Tare ...","montevideo","/anuncio/lavador-chofer-para-estacionamiento-77mh6",2019-06-17 17:38:12
"RESPONSABLE DE GOBIERNO DE DATOS","Importante empresa","Analista","Tecnologías de la información","Hace 1 semana ","o Conocimiento en bases de datos - PL/SQL (excluyente) o Conocimientos PostgreSQL o Manejo experto de Excel, Acces y sistemas de BI (Tableau, Power BI, Goo ...","montevideo","/anuncio/responsable-de-gobierno-de-datos-q6ajn",2019-06-17 17:38:12
"FIAMBRERAS",NA,"Auxiliar","Hotelería - Gastronomía - Turismo","Hace 1 semana "," FIAMBRERAS con experiencia para supermercado se nececita. Presentarse con currículum vitae en:","montevideo","/anuncio/fiambreras-bpung",2019-06-17 17:38:12
"MAQUINISTA",NA,"Oficial","Producción","Hace 1 semana "," Con experiencia en recta, overlock y collareta Para fábrica textil Sexo femenino Edad de 20 a 55 años De 07:00 a 16:30 horas","montevideo","/anuncio/maquinista-2d2qu",2019-06-17 17:38:12
"CADETE",NA,"Auxiliar","Cadetería - Cobranzas","Hace 1 semana ","  Cadete para trámites y repartos con libreta C (camiones).  De lunes a viernes 9:00 a 18:00 hs.  Salario inicial $U 23.000 líq.  Al postularse adju ...","montevideo","/anuncio/cadete-3d42g",2019-06-17 17:38:12
"CADETE",NA,"Auxiliar","Cadetería - Cobranzas","Hace 1 semana "," CADETE con papeles al dia y moto , tiempo completo.","montevideo","/anuncio/cadete-j4edz",2019-06-17 17:38:12
"PELUQUERA COMPLETA",NA,"Técnico / Especialista","Servicios - Oficios","Hace 1 semana "," Con experiencia. Flexibilidad en el horario","montevideo","/anuncio/peluquera-completa-7b5hy",2019-06-17 17:38:12
"ANALISTA DE DATOS","Daltiro SA ","Analista","Administración - Secretariado","Hace 1 semana ","Trabaja directamente con la gerencia comercial.  *Armar indicadores de gestión, reportes de venta, compras, productividad que permita hacer    un benchmark ...","montevideo","/anuncio/analista-de-datos-er783",2019-06-17 17:38:12
"MANDADERO","Importante empresa","Auxiliar","Cadetería - Cobranzas","Hace 1 semana ","entrega de pedidos, entrega de mercaderia en sucursales, stock en el local, tareas adjuntas al cargo segun el mtss debe tener moto cuidar mercaderia que en ...","montevideo","/anuncio/mandadero-sp5ms",2019-06-17 17:38:12
"CHOFER REPARTIDOR",NA,"Peon","Servicios - Oficios","Hace 1 semana "," CHOFER REPARTIDOR c/exp. P/empresa prod.alimenticios.Mayor 25 años, Trabajo estable de lunes a viernes Zona Paso de la Arena.Carné de salud al día.Requisi ...","montevideo","/anuncio/chofer-repartidor-n85tu",2019-06-17 17:38:12
"MANICURA PEDICURA",NA,"Técnico / Especialista","Servicios - Oficios","Hace 1 semana "," Con experiencia en uñas esculpidas.","montevideo","/anuncio/manicura-pedicura-8pvh4",2019-06-17 17:38:12
"VENDEDOR CURSO DE COACHING","Enfoque Eneagrama","Ejecutivo Comercial","Ventas - Comercial","Hace 1 semana ","¿Te interesa el coaching y la inteligencia emocional? ¿Disfrutas hablar en pu´blico?  ¿Tienes un deseo genuino de ayudar a las empresas y su gente a tener  ...","montevideo","/anuncio/vendedor-curso-de-coaching-9sp99",2019-06-17 17:38:12
"OFICIAL DE MANTENIMIENTO","Institución Educativa","Oficial","Producción","Hace 1 semana ","Requisitos: · Formación técnica para el cargo (UTU o similar), titulado · Con conocimientos para el manejo de equipos y sistemas de audio de mediano porte  ...","montevideo","/anuncio/oficial-de-mantenimiento-6v6vh",2019-06-17 17:38:12
"CHOFER PARA TAXI DE MONTEVIDEO","Importante empresa","Peon","Servicios - Oficios","Hace 1 semana ","Chofer de Taxi de Montevideo turno de la tarde de lunes a sábado o solo en el coche jueves, viernes y fines de semana. Libreta Profesional. Con referencias ...","montevideo","/anuncio/chofer-para-taxi-de-montevideo-nj8aa",2019-06-17 17:38:12
"DELIVERY CON MOTO",NA,"Auxiliar","Cadetería - Cobranzas","Hace 1 semana ","Indispensables cumplir requisitos. Se necesita Delivery con moto en buen estado, buena presencia, conocimiento de calles, para zonas Buceo, Malvin, Pocitos ...","montevideo","/anuncio/delivery-con-moto-j9jap",2019-06-17 17:38:12
"ATENCIÓN AL CLIENTE","Empresa en crecimiento","Auxiliar","Administración - Secretariado","Hace 1 semana ","Diversas tareas administrativas Atención a clientes Edad: 20-28 años Lunes a sábados de 9 a 14hs Persona responsable, resolutiva y amable Perfil: buena pre ...","montevideo","/anuncio/atencion-al-cliente-5mvpz",2019-06-17 17:38:12
"PELUQUERA",NA,"Técnico / Especialista","Servicios - Oficios","Hace 1 semana "," ambos sexos p/ Centro Estético en Pocitos sepa cortes, manicuría y podología. Con o sin experiencia.Postularse en Gallito.com","montevideo","/anuncio/peluquera-gbb9a",2019-06-17 17:38:12
"VENDEDOR",NA,"Ejecutivo Comercial","Ventas - Comercial","Hace 1 semana "," Rubro Alimentos  edad hasta 40 años","montevideo","/anuncio/vendedor-t446s",2019-06-17 17:38:12
"OFICIAL SUELERO",NA,"Oficial","Servicios - Oficios","Hace 1 semana "," OFICIAL suelero con experiencia para taller de calzado","montevideo","/anuncio/oficial-suelero-nb2sz",2019-06-17 17:38:12
"AUXILIARES PARA TAREAS VARIAS","Cadena de supermercados","Auxiliar","Producción","Hace 1 semana ","Tareas varias  Se necesita personal EXTRANJERO PARA TAREAS DE: Limpieza, seguridad, reposicion, fiambreria, cajas.  No se requiere experiencia, ambiente d ...","montevideo","/anuncio/auxiliares-para-tareas-varias-8b879",2019-06-17 17:38:12
"AUXILIAR CONTABLE",NA,"Auxiliar","Finanzas - Contabilidad - Auditoria","Hace 1 semana "," AUXILIAR Contable en sistema Wincont y/o Conty. Se valorará experiencia.","montevideo","/anuncio/auxiliar-contable-7q3ua",2019-06-17 17:38:12
"PISTERO PARA ESTACION DE SERVICIO",NA,"Auxiliar","Atención al cliente","Hace 1 semana "," PISTERO para Estación de Servicio. Enviar CV con foto a:","montevideo","/anuncio/pistero-para-estacion-de-servicio-2vega",2019-06-17 17:38:12
"AUXILIAR CONTABLE","Importante empresa","Asistente","Finanzas - Contabilidad - Auditoria","Hace 1 semana ","CONFECCION DE SUELDOS Y LIQUIDACIONES REGISTRACION CONTABLE LIQUIDACION DE IMPUESTOS CONFECCION DE DECLARACIONES JURADAS ARCHIVO CUMPLIMIENTO DE LAS TAREAS ...","montevideo","/anuncio/auxiliar-contable-yn74v",2019-06-17 17:38:12
"PELUQUERO",NA,"Técnico / Especialista","Servicios - Oficios","Hace 1 semana "," PELUQUEROS sepa colorimetria, d epilacion, manos y corte, con refere ncias y experiencia. Para Lagomar","montevideo","/anuncio/peluquero-qeyqm",2019-06-17 17:38:12
"AUXILIAR ADMINISTRATIVA",NA,"Auxiliar","Administración - Secretariado","Hace 1 semana ","  30 a 40 años, tareas administrativas y atencion  telefonica con experiencia buena presencia Lunes a viernes 6 hr diaria s de 12 a 18 hrs sueldo liquido ...","montevideo","/anuncio/auxiliar-administrativa-9sep4",2019-06-17 17:38:12
"TORNERO",NA,"Técnico / Especialista","Producción","Hace 1 semana ","  con referencias llamar","montevideo","/anuncio/tornero-5hrb6",2019-06-17 17:38:12
"AUXILIAR DE SERVICIO",NA,"Auxiliar","Servicios - Oficios","Hace 1 semana "," e Servicio masculino con disponibilidad horaria con titulo, Ciclo Básico para  importante Institución Médica . De 25 a 35 años.","montevideo","/anuncio/auxiliar-de-servicio-y3n3p",2019-06-17 17:38:12
"AUXILIAR DE SERVICIO",NA,"Auxiliar","Servicios - Oficios","Hace 1 semana ","  femenino con titulo, Ciclo Básico c on disponibilidad de 12 a 0 hr  excluyente para importante Ins titución Médica. De 25 a 35 años.","montevideo","/anuncio/auxiliar-de-servicio-45uey",2019-06-17 17:38:12
"EMPRESARIOS ","Karina Forever","Ejecutivo Comercial","Marketing - Publicidad","Hace 1 semana ","Liderar equipos  Capacitarse, Formar equipos, superación continua, buena actitud. ","montevideo","/anuncio/emprresario-pdv83",2019-06-17 17:38:12
"ELEVADORISTA",NA,"Técnico / Especialista","Producción","Hace 1 semana "," ELEVADORISTA para empresa  de productos quimicos industriales y trabajos generales en planta carga, descarga, fracc ionamiento, etc.","montevideo","/anuncio/elevadorista-5vjs3",2019-06-17 17:38:12
"CARGA DESCARGA",NA,"Peon","Logística - Distribución","Hace 1 semana "," PRODUCTOS Quimicos industriale s solicitamos personal co n experiencia cargas descarga  y fracionamiento. Traer curric ulum cmpleto","montevideo","/anuncio/carga-descarga-ndqnq",2019-06-17 17:38:12
"ENCARGADA/O DE TIENDA EN MONTEVIDEO ","CHIC PARISIEN ","Supervisor / Encargado","Ventas - Comercial","Hace 1 semana ","Seleccionamos Encargada/o de local comercial en el Departamento de Montevideo. Orientamos nuestra búsqueda a personas dinámicas con gusto por la venta y la ...","montevideo","/anuncio/encargada-o-de-tienda-en-montevideo-65q3b",2019-06-17 17:38:12
"CHOFER",NA,"Oficial","Servicios - Oficios","Hace 1 semana "," CHOFER efectivo, y suplente taxi.ambos turnos libreta E Montevideo, relevo puerta a puerta.","montevideo","/anuncio/chofer-marva",2019-06-17 17:38:12
"TALLERISTAS",NA,"Oficial","Producción","Hace 1 semana "," Se necesita maquinista, recta, doble y overlok, tarea sencilla y rapida para  arreglos de prendas de jean.  ","montevideo","/anuncio/talleristas-mnp8z",2019-06-17 17:38:12
"ADMINISTRATIVO PARA SECTOR COSTOS","Mutualista Hospital Evangélico","Auxiliar","Administración - Secretariado","Hace 1 semana ","Presentar Curriculum Vitae con foto y comprobantes desde el 07 al 20 de junio de 2019 Requisitos:   *Bachillerato completo. *Auxiliar contable, estudiante  ...","montevideo","/anuncio/administrativo-para-sector-costos-zm946",2019-06-17 17:38:12
"COCINERO - ELABORADOR PARA ROTISERIA/CAFETERIA","IMPORTANTE ROTISERIA CAFETERIA EN CRECIMIENTO","Técnico / Especialista","Hotelería - Gastronomía - Turismo","Hace 1 semana ","Realizará tareas tales como elaboración de tartas, rellenos, menús del día, pasta casera, carnes, milanesas, menús vegetarianos y demás elaboración de prod ...","montevideo","/anuncio/cocinero-elaborador-ama8n",2019-06-17 17:38:12
"VENDEDOR",NA,"Ejecutivo Comercial","Ventas - Comercial","Hace 1 semana "," Agranda tus gananacias sin limite b uenas comiciones y bonos","montevideo","/anuncio/vendedor-d277z",2019-06-17 17:38:12
"LIMPIADORA",NA,"Auxiliar","Servicios - Oficios","Hace 1 semana "," Solo femenino","montevideo","/anuncio/limpiadora-z6pqn",2019-06-17 17:38:12
"ATENCION MOSTRADOR",NA,"Auxiliar","Atención al cliente","Hace 1 semana "," Con experiencia y ganas de trabajar","montevideo","/anuncio/atencion-mostrador-h5bed",2019-06-17 17:38:12
"VENDEDOR VIAJERO",NA,"Ejecutivo Comercial","Ventas - Comercial","Hace 1 semana ","  VENDEDOR Viajero Función: Vendedor de calzado y accesorios para  atender cartera de clientes en Interior y Montevideo. La búsqueda se orienta: Personas ...","montevideo","/anuncio/vendedor-viajero-gbnph",2019-06-17 17:38:12
"AYUDANTE DE ARQUITECTURA",NA,"Asistente","Construcción - Arquitectura","Hace 1 semana "," AYUDANTE de arquitecto (hasta 24 años ) dominos de CAD y experiencia en obra","montevideo","/anuncio/ayudante-de-arquitectura-j7a9z",2019-06-17 17:38:12
"TELEFONISTA",NA,"Auxiliar","Administración - Secretariado","Hace 1 semana "," TELEFONISTA para horario nocturno con experiencia.","montevideo","/anuncio/telefonista-9uyuz",2019-06-17 17:38:12
"AUXILIAR CONTABLE","BROWN JULIA","Auxiliar","Finanzas - Contabilidad - Auditoria","Hace 1 semana ","Auxiliar con experiencia en sueldos y contabilidad. Liquidación de sueldos y de impuestos fiscales. Correspondientes al cargo.  Reporta al Contador.","montevideo","/anuncio/auxiliar-contable-mjh6d",2019-06-17 17:38:12
"MAESTRO PANADERO CON EXPERIENCIA DE 3 AÑOS(EXCLUYENTE)","Importante empresa","Técnico / Especialista","Servicios - Oficios","Hace 1 semana ","Nos encontramos en la búsqueda de un MAESTRO PANADERO con experiencia comprobada mínima de 3 años en elaboración. Horarios: lunes a domingo 14:00 A 22:00 p ...","montevideo","/anuncio/maestro-panadero-con-experiencia-de-3-anos-excluyente-ddr3y",2019-06-17 17:38:12
"VENDEDOR",NA,"Ejecutivo Comercial","Ventas - Comercial","Hace 1 semana "," VENDEDOR Jubilado que este visitando Ferreteria Bazar y Barracas de Montevideo para anexar art. de fabrica","montevideo","/anuncio/vendedor-y2rba",2019-06-17 17:38:12
"AYUDANTE DE COCINA",NA,"Auxiliar","Hotelería - Gastronomía - Turismo","Hace 1 semana "," Con experiencia.","montevideo","/anuncio/ayudante-de-cocina-9r63d",2019-06-17 17:38:12
"ATENCIÓN AL MOSTRADOR",NA,"Auxiliar","Atención al cliente","Hace 1 semana "," Para Fábrica de pastas. c/exp en rotiseria, femenino.","montevideo","/anuncio/atencion-al-mostrador-mdzjp",2019-06-17 17:38:12
"MOZO/A DE SALON",NA,"Auxiliar","Hotelería - Gastronomía - Turismo","Hace 1 semana "," Con experiencia excluyente.","montevideo","/anuncio/mozo-a-de-salon-uq5ej",2019-06-17 17:38:12
"OPERARIO",NA,"Peon","Producción","Hace 1 semana "," OPERARIO para  Fábrica Productos Alimenticios.Trabajo estable de lunes a viernes , zona Paso de la Arena. Carné de salud al día","montevideo","/anuncio/operario-uqg43",2019-06-17 17:38:12
"VENDEDOR PARA AUTOMOTORA",NA,"Ejecutivo Comercial","Ventas - Comercial","Hace 1 semana "," Vendedor masculino Selecciona Importante Concesionaria Automotriz Excluyente con experiencia en el rubro","montevideo","/anuncio/vendedor-para-automotora-3r5n2",2019-06-17 17:38:12
"IMPORTANTE FRANQUICIA INTERNACIONAL RECLUTA BARBER@S",NA,"Técnico / Especialista","Servicios - Oficios","Hace 1 semana "," IMPORTANTE Franquicia Internacional recluta barbero/a  con Experiencia Enviar  C.V.  THE BARBER JOB - MONTEVIDEO.","montevideo","/anuncio/importante-franquicia-internacional-recluta-barber-s-275g6",2019-06-17 17:38:12
"MANICURA",NA,"Técnico / Especialista","Servicios - Oficios","Hace 1 semana "," MANICURA para salon de nivel hasta 40 años zona Punta Carretas","montevideo","/anuncio/manicura-anhrz",2019-06-17 17:38:12
